Hospital Name,Category,ServiceCode,ServiceName,ServicePrice,State
Physicians Surgical Hospital,Female Reproductive,MSDRG 743,"Uterine and adnexa procedures, non-malignancy","$39,238.55",TX
Physicians Surgical Hospital,Musculoskeletal,MSDRG 455,Bi-lateral (combined anterior/posterior) spinal fusion,"$67,214.71",TX
Physicians Surgical Hospital,Musculoskeletal,MSDRG 470,Joint replacement (hip or knee),"$35,144.83",TX
Physicians Surgical Hospital,Musculoskeletal,MSDRG 473,Spinal fusion (cervical),"$42,792.90",TX
Physicians Surgical Hospital,Musculoskeletal,MSDRG 460,Spinal fusion (non-cervical),"$50,131.13",TX
