Encompass Health Rehabilitation Hospital of Miami,,,,,,,,,,,,,,,,,,,,,,,,,,,,,,,,,,,,,,,,,,,,,,,,,,
Prices Posted and Effective 1/1/2021,,,,,,,,,,,,,,,,,,,,,,,,,,,,,,,,,,,,,,,,,,,,,,,,,,
Note: General file information and additional details can be found on the Price Transparency page of this hospital's website,,,,,,,,,,,,,,,,,,,,,,,,,,,,,,,,,,,,,,,,,,,,,,,,,,
,,,,,,,,,,,,,,,,,,,,,,,,,,,,,,,,,,,,,,,,,,,,,,,,,,
PATIENT_TYPE,SHOPPABLE_SERVICES,BILLING_REVENUE_SERVICE_CODE,GROSS_CHARGE,DISCOUNTED_CASH_PRICE,DEIDENTIFIED_MIN_NEGOTIATED_CHARGE,DEIDENTIFIED_MAX_NEGOTIATED_CHARGE,ADVANET WORK COMP (ADVW) negotiated charge,AETNA (AET) negotiated charge,AETNA MEDICARE (AETM) negotiated charge,AETNA WORKERS COMP ACCESS (AETW) negotiated charge,AVMED HEALTH MEDICARE (AVMM) negotiated charge,AVMED HEALTH PLAN (AVMD) negotiated charge,BC HEALTH OPTIONS EXCHANG (BHOZ) negotiated charge,BCBS OUT OF STATE (BCBS) negotiated charge,BCFL BLUE SELECT (BCSE) negotiated charge,BCFL TRADITIONAL (BCFL) negotiated charge,BLUE CROSS HEALTH OPTIONS (BCHO) negotiated charge,CAREPLUS HEALTH MEDICARE (CPHM) negotiated charge,CAREWORKS (CRW) negotiated charge,CAREWORKS WORK COMP (CRWW) negotiated charge,CHAMPVA (CVA) negotiated charge,CIGNA (CIG) negotiated charge,CORVEL WORK COMP (CVLW) negotiated charge,COVENTRY HEALTHCARE (CHC) negotiated charge,FEDERAL BLUE CROSS (BCFD) negotiated charge,FIRST HEALTH (FTH) negotiated charge,FIRST HEALTH WORK COMP (FTHW) negotiated charge,HEALTH OPTIONS MEDICARE (BCHM) negotiated charge,HEALTHEASE STAYWELL (WLCS) negotiated charge,HERITAGE SUMMIT WORK COMP (HSHW) negotiated charge,HUMANA (HUM) negotiated charge,HUMANA EXCHANGE (HUMZ) negotiated charge,HUMANA MEDICAID (HUMD) negotiated charge,HUMANA MEDICARE (HUMM) negotiated charge,MEDICAL PARTNERS OF AM (MPAM) negotiated charge,MULTIPLAN (MUL) negotiated charge,NETWORK BLUE MEDICARE (BCBM) negotiated charge,ONE CALL MEDICAL WC (OCLW) negotiated charge,PRIVATE HEALTHCARE SYSTEM (PHST) negotiated charge,PROVIDER NET OF AMERICA (PAM) negotiated charge,PYR/AMERICAN PROGRESSIVE (AMPM) negotiated charge,THE RENY COMPANY WC (REN) negotiated charge,TRICARE (TRI) negotiated charge,UHC VA CCN (UHV) negotiated charge,UNITED HEALTHCARE (UHC) negotiated charge,UNITED HEALTHCARE MEDICAR (UHCM) negotiated charge,VISTA HEALTHCARE MEDICARE (VISM) negotiated charge,WELLCARE MEDICARE (WLCM) negotiated charge,ZELIAS NET SOLUTIONS WC (ZNSW) negotiated charge,ZELIAS NETWORK SOLUTIONS (ZNS) negotiated charge
Inpatient Rehabilitation Services,"Removal of 1 or more breast growth, open procedure",19120,NA,NA,NA,NA,NA,NA,NA,NA,NA,NA,NA,NA,NA,NA,NA,NA,NA,NA,NA,NA,NA,NA,NA,NA,NA,NA,NA,NA,NA,NA,NA,NA,NA,NA,NA,NA,NA,NA,NA,NA,NA,NA,NA,NA,NA,NA,NA,NA
Inpatient Rehabilitation Services,Cardiac valve and other major cardiothoracic procedures with cardiac catheterization with major complications or comorbidities,216,NA,NA,NA,NA,NA,NA,NA,NA,NA,NA,NA,NA,NA,NA,NA,NA,NA,NA,NA,NA,NA,NA,NA,NA,NA,NA,NA,NA,NA,NA,NA,NA,NA,NA,NA,NA,NA,NA,NA,NA,NA,NA,NA,NA,NA,NA,NA,NA
Inpatient Rehabilitation Services,Shaving of shoulder bone using an endoscope,29826,NA,NA,NA,NA,NA,NA,NA,NA,NA,NA,NA,NA,NA,NA,NA,NA,NA,NA,NA,NA,NA,NA,NA,NA,NA,NA,NA,NA,NA,NA,NA,NA,NA,NA,NA,NA,NA,NA,NA,NA,NA,NA,NA,NA,NA,NA,NA,NA
Inpatient Rehabilitation Services,Removal of one knee cartilage using an endoscope,29881,NA,NA,NA,NA,NA,NA,NA,NA,NA,NA,NA,NA,NA,NA,NA,NA,NA,NA,NA,NA,NA,NA,NA,NA,NA,NA,NA,NA,NA,NA,NA,NA,NA,NA,NA,NA,NA,NA,NA,NA,NA,NA,NA,NA,NA,NA,NA,NA
Inpatient Rehabilitation Services,Removal of tonsils and adenoid glands patient younger than age 12,42820,NA,NA,NA,NA,NA,NA,NA,NA,NA,NA,NA,NA,NA,NA,NA,NA,NA,NA,NA,NA,NA,NA,NA,NA,NA,NA,NA,NA,NA,NA,NA,NA,NA,NA,NA,NA,NA,NA,NA,NA,NA,NA,NA,NA,NA,NA,NA,NA
Inpatient Rehabilitation Services,"Diagnostic examination of esophagus, stomach, and/or upper small bowel using an endoscope",43235,NA,NA,NA,NA,NA,NA,NA,NA,NA,NA,NA,NA,NA,NA,NA,NA,NA,NA,NA,NA,NA,NA,NA,NA,NA,NA,NA,NA,NA,NA,NA,NA,NA,NA,NA,NA,NA,NA,NA,NA,NA,NA,NA,NA,NA,NA,NA,NA
Inpatient Rehabilitation Services,"Biopsy of the esophagus, stomach, and/or upper small bowel using an endoscope",43239,NA,NA,NA,NA,NA,NA,NA,NA,NA,NA,NA,NA,NA,NA,NA,NA,NA,NA,NA,NA,NA,NA,NA,NA,NA,NA,NA,NA,NA,NA,NA,NA,NA,NA,NA,NA,NA,NA,NA,NA,NA,NA,NA,NA,NA,NA,NA,NA
Inpatient Rehabilitation Services,Diagnostic examination of large bowel using an endoscope,45378,NA,NA,NA,NA,NA,NA,NA,NA,NA,NA,NA,NA,NA,NA,NA,NA,NA,NA,NA,NA,NA,NA,NA,NA,NA,NA,NA,NA,NA,NA,NA,NA,NA,NA,NA,NA,NA,NA,NA,NA,NA,NA,NA,NA,NA,NA,NA,NA
Inpatient Rehabilitation Services,Biopsy of large bowel using an endoscope,45380,NA,NA,NA,NA,NA,NA,NA,NA,NA,NA,NA,NA,NA,NA,NA,NA,NA,NA,NA,NA,NA,NA,NA,NA,NA,NA,NA,NA,NA,NA,NA,NA,NA,NA,NA,NA,NA,NA,NA,NA,NA,NA,NA,NA,NA,NA,NA,NA
Inpatient Rehabilitation Services,Removal of polyps or growths of large bowel using an endoscope,45385,NA,NA,NA,NA,NA,NA,NA,NA,NA,NA,NA,NA,NA,NA,NA,NA,NA,NA,NA,NA,NA,NA,NA,NA,NA,NA,NA,NA,NA,NA,NA,NA,NA,NA,NA,NA,NA,NA,NA,NA,NA,NA,NA,NA,NA,NA,NA,NA
Inpatient Rehabilitation Services,Ultrasound examination of lower large bowel using an endoscope,45391,NA,NA,NA,NA,NA,NA,NA,NA,NA,NA,NA,NA,NA,NA,NA,NA,NA,NA,NA,NA,NA,NA,NA,NA,NA,NA,NA,NA,NA,NA,NA,NA,NA,NA,NA,NA,NA,NA,NA,NA,NA,NA,NA,NA,NA,NA,NA,NA
Inpatient Rehabilitation Services,Spinal fusion except cervical without major comorbid conditions or complications,460,NA,NA,NA,NA,NA,NA,NA,NA,NA,NA,NA,NA,NA,NA,NA,NA,NA,NA,NA,NA,NA,NA,NA,NA,NA,NA,NA,NA,NA,NA,NA,NA,NA,NA,NA,NA,NA,NA,NA,NA,NA,NA,NA,NA,NA,NA,NA,NA
Inpatient Rehabilitation Services,Major joint replacement or reattachment of lower extremity without major comorbid conditions or complications,470,NA,NA,NA,NA,NA,NA,NA,NA,NA,NA,NA,NA,NA,NA,NA,NA,NA,NA,NA,NA,NA,NA,NA,NA,NA,NA,NA,NA,NA,NA,NA,NA,NA,NA,NA,NA,NA,NA,NA,NA,NA,NA,NA,NA,NA,NA,NA,NA
Inpatient Rehabilitation Services,Cervical spinal fusion without comorbid conditions or major comorbid conditions or complications,473,NA,NA,NA,NA,NA,NA,NA,NA,NA,NA,NA,NA,NA,NA,NA,NA,NA,NA,NA,NA,NA,NA,NA,NA,NA,NA,NA,NA,NA,NA,NA,NA,NA,NA,NA,NA,NA,NA,NA,NA,NA,NA,NA,NA,NA,NA,NA,NA
Inpatient Rehabilitation Services,Removal of gallbladder using an endoscope,47562,NA,NA,NA,NA,NA,NA,NA,NA,NA,NA,NA,NA,NA,NA,NA,NA,NA,NA,NA,NA,NA,NA,NA,NA,NA,NA,NA,NA,NA,NA,NA,NA,NA,NA,NA,NA,NA,NA,NA,NA,NA,NA,NA,NA,NA,NA,NA,NA
Inpatient Rehabilitation Services,Repair of groin hernia patient age 5 or older,49505,NA,NA,NA,NA,NA,NA,NA,NA,NA,NA,NA,NA,NA,NA,NA,NA,NA,NA,NA,NA,NA,NA,NA,NA,NA,NA,NA,NA,NA,NA,NA,NA,NA,NA,NA,NA,NA,NA,NA,NA,NA,NA,NA,NA,NA,NA,NA,NA
Inpatient Rehabilitation Services,Biopsy of prostate gland,55700,NA,NA,NA,NA,NA,NA,NA,NA,NA,NA,NA,NA,NA,NA,NA,NA,NA,NA,NA,NA,NA,NA,NA,NA,NA,NA,NA,NA,NA,NA,NA,NA,NA,NA,NA,NA,NA,NA,NA,NA,NA,NA,NA,NA,NA,NA,NA,NA
Inpatient Rehabilitation Services,Surgical removal of prostate and surrounding lymph nodes using an endoscope,55866,NA,NA,NA,NA,NA,NA,NA,NA,NA,NA,NA,NA,NA,NA,NA,NA,NA,NA,NA,NA,NA,NA,NA,NA,NA,NA,NA,NA,NA,NA,NA,NA,NA,NA,NA,NA,NA,NA,NA,NA,NA,NA,NA,NA,NA,NA,NA,NA
Inpatient Rehabilitation Services,"Routine obstetric care for vaginal delivery, including pre-and post-delivery care",59400,NA,NA,NA,NA,NA,NA,NA,NA,NA,NA,NA,NA,NA,NA,NA,NA,NA,NA,NA,NA,NA,NA,NA,NA,NA,NA,NA,NA,NA,NA,NA,NA,NA,NA,NA,NA,NA,NA,NA,NA,NA,NA,NA,NA,NA,NA,NA,NA
Inpatient Rehabilitation Services,"Routine obstetric care for cesarean delivery, including pre-and post-delivery care",59510,NA,NA,NA,NA,NA,NA,NA,NA,NA,NA,NA,NA,NA,NA,NA,NA,NA,NA,NA,NA,NA,NA,NA,NA,NA,NA,NA,NA,NA,NA,NA,NA,NA,NA,NA,NA,NA,NA,NA,NA,NA,NA,NA,NA,NA,NA,NA,NA
Inpatient Rehabilitation Services,Routine obstetric care for vaginal delivery after prior cesarean delivery including pre-and post-delivery care,59610,NA,NA,NA,NA,NA,NA,NA,NA,NA,NA,NA,NA,NA,NA,NA,NA,NA,NA,NA,NA,NA,NA,NA,NA,NA,NA,NA,NA,NA,NA,NA,NA,NA,NA,NA,NA,NA,NA,NA,NA,NA,NA,NA,NA,NA,NA,NA,NA
Inpatient Rehabilitation Services,Injection of substance into spinal canal of lower back or sacrum using imaging guidance,62322,NA,NA,NA,NA,NA,NA,NA,NA,NA,NA,NA,NA,NA,NA,NA,NA,NA,NA,NA,NA,NA,NA,NA,NA,NA,NA,NA,NA,NA,NA,NA,NA,NA,NA,NA,NA,NA,NA,NA,NA,NA,NA,NA,NA,NA,NA,NA,NA
Inpatient Rehabilitation Services,Injection of substance into spinal canal of lower back or sacrum using imaging guidance,62323,NA,NA,NA,NA,NA,NA,NA,NA,NA,NA,NA,NA,NA,NA,NA,NA,NA,NA,NA,NA,NA,NA,NA,NA,NA,NA,NA,NA,NA,NA,NA,NA,NA,NA,NA,NA,NA,NA,NA,NA,NA,NA,NA,NA,NA,NA,NA,NA
Inpatient Rehabilitation Services,Injections of anesthetic and/or steroid drug into lower or sacral spine nerve root using imaging guidance,64483,NA,NA,NA,NA,NA,NA,NA,NA,NA,NA,NA,NA,NA,NA,NA,NA,NA,NA,NA,NA,NA,NA,NA,NA,NA,NA,NA,NA,NA,NA,NA,NA,NA,NA,NA,NA,NA,NA,NA,NA,NA,NA,NA,NA,NA,NA,NA,NA
Inpatient Rehabilitation Services,Removal of recurring cataract in lens capsule using laser,66821,NA,NA,NA,NA,NA,NA,NA,NA,NA,NA,NA,NA,NA,NA,NA,NA,NA,NA,NA,NA,NA,NA,NA,NA,NA,NA,NA,NA,NA,NA,NA,NA,NA,NA,NA,NA,NA,NA,NA,NA,NA,NA,NA,NA,NA,NA,NA,NA
Inpatient Rehabilitation Services,Removal of cataract with insertion of lens,66984,NA,NA,NA,NA,NA,NA,NA,NA,NA,NA,NA,NA,NA,NA,NA,NA,NA,NA,NA,NA,NA,NA,NA,NA,NA,NA,NA,NA,NA,NA,NA,NA,NA,NA,NA,NA,NA,NA,NA,NA,NA,NA,NA,NA,NA,NA,NA,NA
Inpatient Rehabilitation Services,"CT scan, head or brain, without contrast",70450,$592.00,$444.00,$414.40,$497.28,NA,NA,NA,NA,NA,NA,NA,NA,NA,NA,NA,NA,$473.60,$497.28,NA,NA,NA,NA,NA,NA,NA,NA,NA,NA,NA,NA,NA,NA,NA,$414.40,NA,NA,$414.40,NA,NA,NA,NA,NA,NA,NA,NA,NA,NA,$473.60
Inpatient Rehabilitation Services,MRI scan of brain before and after contrast,70553,$1372.00,$1029.00,$960.40,$1152.48,NA,NA,NA,NA,NA,NA,NA,NA,NA,NA,NA,NA,$1097.60,$1152.48,NA,NA,NA,NA,NA,NA,NA,NA,NA,NA,NA,NA,NA,NA,NA,$960.40,NA,NA,$960.40,NA,NA,NA,NA,NA,NA,NA,NA,NA,NA,$1097.60
Inpatient Rehabilitation Services,"X-Ray, lower back, minimum four views",72110,$423.00,$317.25,$296.10,$355.32,NA,NA,NA,NA,NA,NA,NA,NA,NA,NA,NA,NA,$338.40,$355.32,NA,NA,NA,NA,NA,NA,NA,NA,NA,NA,NA,NA,NA,NA,NA,$296.10,NA,NA,$296.10,NA,NA,NA,NA,NA,NA,NA,NA,NA,NA,$338.40
Inpatient Rehabilitation Services,MRI scan of lower spinal canal,72148,$929.00,$696.75,$650.30,$780.36,NA,NA,NA,NA,NA,NA,NA,NA,NA,NA,NA,NA,$743.20,$780.36,NA,NA,NA,NA,NA,NA,NA,NA,NA,NA,NA,NA,NA,NA,NA,$650.30,NA,NA,$650.30,NA,NA,NA,NA,NA,NA,NA,NA,NA,NA,$743.20
Inpatient Rehabilitation Services,"CT scan, pelvis, with contrast",72193,$847.00,$635.25,$592.90,$711.48,NA,NA,NA,NA,NA,NA,NA,NA,NA,NA,NA,NA,$677.60,$711.48,NA,NA,NA,NA,NA,NA,NA,NA,NA,NA,NA,NA,NA,NA,NA,$592.90,NA,NA,$592.90,NA,NA,NA,NA,NA,NA,NA,NA,NA,NA,$677.60
Inpatient Rehabilitation Services,MRI scan of leg joint,73721,$1426.00,$1069.50,$998.20,$1197.84,NA,NA,NA,NA,NA,NA,NA,NA,NA,NA,NA,NA,$1140.80,$1197.84,NA,NA,NA,NA,NA,NA,NA,NA,NA,NA,NA,NA,NA,NA,NA,$998.20,NA,NA,$998.20,NA,NA,NA,NA,NA,NA,NA,NA,NA,NA,$1140.80
Inpatient Rehabilitation Services,CT scan of abdomen and pelvis with contrast,74177,$1372.00,$1029.00,$960.40,$1152.48,NA,NA,NA,NA,NA,NA,NA,NA,NA,NA,NA,NA,$1097.60,$1152.48,NA,NA,NA,NA,NA,NA,NA,NA,NA,NA,NA,NA,NA,NA,NA,$960.40,NA,NA,$960.40,NA,NA,NA,NA,NA,NA,NA,NA,NA,NA,$1097.60
Inpatient Rehabilitation Services,Uterine and adnexa procedures for non-malignancy without comorbid conditions or major comorbid conditions or complications,743,NA,NA,NA,NA,NA,NA,NA,NA,NA,NA,NA,NA,NA,NA,NA,NA,NA,NA,NA,NA,NA,NA,NA,NA,NA,NA,NA,NA,NA,NA,NA,NA,NA,NA,NA,NA,NA,NA,NA,NA,NA,NA,NA,NA,NA,NA,NA,NA
Inpatient Rehabilitation Services,Ultrasound of abdomen,76700,$192.00,$144.00,$134.40,$161.28,NA,NA,NA,NA,NA,NA,NA,NA,NA,NA,NA,NA,$153.60,$161.28,NA,NA,NA,NA,NA,NA,NA,NA,NA,NA,NA,NA,NA,NA,NA,$134.40,NA,NA,$134.40,NA,NA,NA,NA,NA,NA,NA,NA,NA,NA,$153.60
Inpatient Rehabilitation Services,"Abdominal ultrasound of pregnant uterus, greater or equal to 14 weeks 0 days, single or first fetus",76805,NA,NA,NA,NA,NA,NA,NA,NA,NA,NA,NA,NA,NA,NA,NA,NA,NA,NA,NA,NA,NA,NA,NA,NA,NA,NA,NA,NA,NA,NA,NA,NA,NA,NA,NA,NA,NA,NA,NA,NA,NA,NA,NA,NA,NA,NA,NA,NA
Inpatient Rehabilitation Services,Ultrasound pelvis through vagina,76830,NA,NA,NA,NA,NA,NA,NA,NA,NA,NA,NA,NA,NA,NA,NA,NA,NA,NA,NA,NA,NA,NA,NA,NA,NA,NA,NA,NA,NA,NA,NA,NA,NA,NA,NA,NA,NA,NA,NA,NA,NA,NA,NA,NA,NA,NA,NA,NA
Inpatient Rehabilitation Services,Mammography of one breast,77065,NA,NA,NA,NA,NA,NA,NA,NA,NA,NA,NA,NA,NA,NA,NA,NA,NA,NA,NA,NA,NA,NA,NA,NA,NA,NA,NA,NA,NA,NA,NA,NA,NA,NA,NA,NA,NA,NA,NA,NA,NA,NA,NA,NA,NA,NA,NA,NA
Inpatient Rehabilitation Services,Mammography of both breasts,77066,NA,NA,NA,NA,NA,NA,NA,NA,NA,NA,NA,NA,NA,NA,NA,NA,NA,NA,NA,NA,NA,NA,NA,NA,NA,NA,NA,NA,NA,NA,NA,NA,NA,NA,NA,NA,NA,NA,NA,NA,NA,NA,NA,NA,NA,NA,NA,NA
Inpatient Rehabilitation Services,"Mammography, screening, bilateral",77067,NA,NA,NA,NA,NA,NA,NA,NA,NA,NA,NA,NA,NA,NA,NA,NA,NA,NA,NA,NA,NA,NA,NA,NA,NA,NA,NA,NA,NA,NA,NA,NA,NA,NA,NA,NA,NA,NA,NA,NA,NA,NA,NA,NA,NA,NA,NA,NA
Inpatient Rehabilitation Services,Basic metabolic panel,80048,$47.00,$35.25,$32.90,$39.48,NA,NA,NA,NA,NA,NA,NA,NA,NA,NA,NA,NA,$37.60,$39.48,NA,NA,NA,NA,NA,NA,NA,NA,NA,NA,NA,NA,NA,NA,NA,$32.90,NA,NA,$32.90,NA,NA,NA,NA,NA,NA,NA,NA,NA,NA,$37.60
Inpatient Rehabilitation Services,"Blood test, comprehensive group of blood chemicals",80053,$52.00,$39.00,$36.40,$43.68,NA,NA,NA,NA,NA,NA,NA,NA,NA,NA,NA,NA,$41.60,$43.68,NA,NA,NA,NA,NA,NA,NA,NA,NA,NA,NA,NA,NA,NA,NA,$36.40,NA,NA,$36.40,NA,NA,NA,NA,NA,NA,NA,NA,NA,NA,$41.60
Inpatient Rehabilitation Services,Obstetric blood test panel,80055,NA,NA,NA,NA,NA,NA,NA,NA,NA,NA,NA,NA,NA,NA,NA,NA,NA,NA,NA,NA,NA,NA,NA,NA,NA,NA,NA,NA,NA,NA,NA,NA,NA,NA,NA,NA,NA,NA,NA,NA,NA,NA,NA,NA,NA,NA,NA,NA
Inpatient Rehabilitation Services,"Blood test, lipids",80061,$45.00,$33.75,$31.50,$37.80,NA,NA,NA,NA,NA,NA,NA,NA,NA,NA,NA,NA,$36.00,$37.80,NA,NA,NA,NA,NA,NA,NA,NA,NA,NA,NA,NA,NA,NA,NA,$31.50,NA,NA,$31.50,NA,NA,NA,NA,NA,NA,NA,NA,NA,NA,$36.00
Inpatient Rehabilitation Services,Kidney function panel test,80069,$29.00,$21.75,$20.30,$24.36,NA,NA,NA,NA,NA,NA,NA,NA,NA,NA,NA,NA,$23.20,$24.36,NA,NA,NA,NA,NA,NA,NA,NA,NA,NA,NA,NA,NA,NA,NA,$20.30,NA,NA,$20.30,NA,NA,NA,NA,NA,NA,NA,NA,NA,NA,$23.20
Inpatient Rehabilitation Services,Liver function blood test panel,80076,NA,NA,NA,NA,NA,NA,NA,NA,NA,NA,NA,NA,NA,NA,NA,NA,NA,NA,NA,NA,NA,NA,NA,NA,NA,NA,NA,NA,NA,NA,NA,NA,NA,NA,NA,NA,NA,NA,NA,NA,NA,NA,NA,NA,NA,NA,NA,NA
Inpatient Rehabilitation Services,Manual urinalysis test with examination using microscope,81000,$13.00,$9.75,$9.10,$10.92,NA,NA,NA,NA,NA,NA,NA,NA,NA,NA,NA,NA,$10.40,$10.92,NA,NA,NA,NA,NA,NA,NA,NA,NA,NA,NA,NA,NA,NA,NA,$9.10,NA,NA,$9.10,NA,NA,NA,NA,NA,NA,NA,NA,NA,NA,$10.40
Inpatient Rehabilitation Services,Manual urinalysis test with examination using microscope,81001,$11.00,$8.25,$7.70,$9.24,NA,NA,NA,NA,NA,NA,NA,NA,NA,NA,NA,NA,$8.80,$9.24,NA,NA,NA,NA,NA,NA,NA,NA,NA,NA,NA,NA,NA,NA,NA,$7.70,NA,NA,$7.70,NA,NA,NA,NA,NA,NA,NA,NA,NA,NA,$8.80
Inpatient Rehabilitation Services,Automated urinalysis test,81002,$11.00,$8.25,$7.70,$9.24,NA,NA,NA,NA,NA,NA,NA,NA,NA,NA,NA,NA,$8.80,$9.24,NA,NA,NA,NA,NA,NA,NA,NA,NA,NA,NA,NA,NA,NA,NA,$7.70,NA,NA,$7.70,NA,NA,NA,NA,NA,NA,NA,NA,NA,NA,$8.80
Inpatient Rehabilitation Services,Automated urinalysis test,81003,$8.00,$6.00,$5.60,$6.72,NA,NA,NA,NA,NA,NA,NA,NA,NA,NA,NA,NA,$6.40,$6.72,NA,NA,NA,NA,NA,NA,NA,NA,NA,NA,NA,NA,NA,NA,NA,$5.60,NA,NA,$5.60,NA,NA,NA,NA,NA,NA,NA,NA,NA,NA,$6.40
Inpatient Rehabilitation Services,Prostate specific antigen,84153,$62.00,$46.50,$43.40,$52.08,NA,NA,NA,NA,NA,NA,NA,NA,NA,NA,NA,NA,$49.60,$52.08,NA,NA,NA,NA,NA,NA,NA,NA,NA,NA,NA,NA,NA,NA,NA,$43.40,NA,NA,$43.40,NA,NA,NA,NA,NA,NA,NA,NA,NA,NA,$49.60
Inpatient Rehabilitation Services,Prostate specific antigen,84154,$62.00,$46.50,$43.40,$52.08,NA,NA,NA,NA,NA,NA,NA,NA,NA,NA,NA,NA,$49.60,$52.08,NA,NA,NA,NA,NA,NA,NA,NA,NA,NA,NA,NA,NA,NA,NA,$43.40,NA,NA,$43.40,NA,NA,NA,NA,NA,NA,NA,NA,NA,NA,$49.60
Inpatient Rehabilitation Services,"Blood test, thyroid stimulating hormone",84443,$57.00,$42.75,$39.90,$47.88,NA,NA,NA,NA,NA,NA,NA,NA,NA,NA,NA,NA,$45.60,$47.88,NA,NA,NA,NA,NA,NA,NA,NA,NA,NA,NA,NA,NA,NA,NA,$39.90,NA,NA,$39.90,NA,NA,NA,NA,NA,NA,NA,NA,NA,NA,$45.60
Inpatient Rehabilitation Services,"Complete blood cell count, with differential white blood cells, automated",85025,$39.00,$29.25,$27.30,$32.76,NA,NA,NA,NA,NA,NA,NA,NA,NA,NA,NA,NA,$31.20,$32.76,NA,NA,NA,NA,NA,NA,NA,NA,NA,NA,NA,NA,NA,NA,NA,$27.30,NA,NA,$27.30,NA,NA,NA,NA,NA,NA,NA,NA,NA,NA,$31.20
Inpatient Rehabilitation Services,"Complete blood count, automated",85027,$39.00,$29.25,$27.30,$32.76,NA,NA,NA,NA,NA,NA,NA,NA,NA,NA,NA,NA,$31.20,$32.76,NA,NA,NA,NA,NA,NA,NA,NA,NA,NA,NA,NA,NA,NA,NA,$27.30,NA,NA,$27.30,NA,NA,NA,NA,NA,NA,NA,NA,NA,NA,$31.20
Inpatient Rehabilitation Services,"Blood test, clotting time",85610,NA,NA,NA,NA,NA,NA,NA,NA,NA,NA,NA,NA,NA,NA,NA,NA,NA,NA,NA,NA,NA,NA,NA,NA,NA,NA,NA,NA,NA,NA,NA,NA,NA,NA,NA,NA,NA,NA,NA,NA,NA,NA,NA,NA,NA,NA,NA,NA
Inpatient Rehabilitation Services,Coagulation assessment blood test,85730,NA,NA,NA,NA,NA,NA,NA,NA,NA,NA,NA,NA,NA,NA,NA,NA,NA,NA,NA,NA,NA,NA,NA,NA,NA,NA,NA,NA,NA,NA,NA,NA,NA,NA,NA,NA,NA,NA,NA,NA,NA,NA,NA,NA,NA,NA,NA,NA
Inpatient Rehabilitation Services,"Psychotherapy, 30 minutes",90832,NA,NA,NA,NA,NA,NA,NA,NA,NA,NA,NA,NA,NA,NA,NA,NA,NA,NA,NA,NA,NA,NA,NA,NA,NA,NA,NA,NA,NA,NA,NA,NA,NA,NA,NA,NA,NA,NA,NA,NA,NA,NA,NA,NA,NA,NA,NA,NA
Inpatient Rehabilitation Services,"Psychotherapy, 45 minutes",90834,NA,NA,NA,NA,NA,NA,NA,NA,NA,NA,NA,NA,NA,NA,NA,NA,NA,NA,NA,NA,NA,NA,NA,NA,NA,NA,NA,NA,NA,NA,NA,NA,NA,NA,NA,NA,NA,NA,NA,NA,NA,NA,NA,NA,NA,NA,NA,NA
Inpatient Rehabilitation Services,"Psychotherapy, 60 minutes",90837,NA,NA,NA,NA,NA,NA,NA,NA,NA,NA,NA,NA,NA,NA,NA,NA,NA,NA,NA,NA,NA,NA,NA,NA,NA,NA,NA,NA,NA,NA,NA,NA,NA,NA,NA,NA,NA,NA,NA,NA,NA,NA,NA,NA,NA,NA,NA,NA
Inpatient Rehabilitation Services,"Family psychotherapy, not including patient, 50 minutes",90846,NA,NA,NA,NA,NA,NA,NA,NA,NA,NA,NA,NA,NA,NA,NA,NA,NA,NA,NA,NA,NA,NA,NA,NA,NA,NA,NA,NA,NA,NA,NA,NA,NA,NA,NA,NA,NA,NA,NA,NA,NA,NA,NA,NA,NA,NA,NA,NA
Inpatient Rehabilitation Services,"Family psychotherapy, including patient, 50 min",90847,NA,NA,NA,NA,NA,NA,NA,NA,NA,NA,NA,NA,NA,NA,NA,NA,NA,NA,NA,NA,NA,NA,NA,NA,NA,NA,NA,NA,NA,NA,NA,NA,NA,NA,NA,NA,NA,NA,NA,NA,NA,NA,NA,NA,NA,NA,NA,NA
Inpatient Rehabilitation Services,Group psychotherapy,90853,NA,NA,NA,NA,NA,NA,NA,NA,NA,NA,NA,NA,NA,NA,NA,NA,NA,NA,NA,NA,NA,NA,NA,NA,NA,NA,NA,NA,NA,NA,NA,NA,NA,NA,NA,NA,NA,NA,NA,NA,NA,NA,NA,NA,NA,NA,NA,NA
Inpatient Rehabilitation Services,"Electrocardiogram, routine, with interpretation and report",93000,$166.00,$124.50,$116.20,$139.44,NA,NA,NA,NA,NA,NA,NA,NA,NA,NA,NA,NA,$132.80,$139.44,NA,NA,NA,NA,NA,NA,NA,NA,NA,NA,NA,NA,NA,NA,NA,$116.20,NA,NA,$116.20,NA,NA,NA,NA,NA,NA,NA,NA,NA,NA,$132.80
Inpatient Rehabilitation Services,Insertion of catheter into left heart for diagnosis,93452,NA,NA,NA,NA,NA,NA,NA,NA,NA,NA,NA,NA,NA,NA,NA,NA,NA,NA,NA,NA,NA,NA,NA,NA,NA,NA,NA,NA,NA,NA,NA,NA,NA,NA,NA,NA,NA,NA,NA,NA,NA,NA,NA,NA,NA,NA,NA,NA
Inpatient Rehabilitation Services,Sleep study,95810,NA,NA,NA,NA,NA,NA,NA,NA,NA,NA,NA,NA,NA,NA,NA,NA,NA,NA,NA,NA,NA,NA,NA,NA,NA,NA,NA,NA,NA,NA,NA,NA,NA,NA,NA,NA,NA,NA,NA,NA,NA,NA,NA,NA,NA,NA,NA,NA
Inpatient Rehabilitation Services,"Physical therapy, therapeutic exercise",97110,$87.00,$65.25,$60.90,$73.08,NA,NA,NA,NA,NA,NA,NA,NA,NA,NA,NA,NA,$69.60,$73.08,NA,NA,NA,NA,NA,NA,NA,NA,NA,NA,NA,NA,NA,NA,NA,$60.90,NA,NA,$60.90,NA,NA,NA,NA,NA,NA,NA,NA,NA,NA,$69.60
Inpatient Rehabilitation Services,"New patient office or other outpatient visit, typically 30 min",99203,NA,NA,NA,NA,NA,NA,NA,NA,NA,NA,NA,NA,NA,NA,NA,NA,NA,NA,NA,NA,NA,NA,NA,NA,NA,NA,NA,NA,NA,NA,NA,NA,NA,NA,NA,NA,NA,NA,NA,NA,NA,NA,NA,NA,NA,NA,NA,NA
Inpatient Rehabilitation Services,"New patient office of other outpatient visit, typically 45 min",99204,NA,NA,NA,NA,NA,NA,NA,NA,NA,NA,NA,NA,NA,NA,NA,NA,NA,NA,NA,NA,NA,NA,NA,NA,NA,NA,NA,NA,NA,NA,NA,NA,NA,NA,NA,NA,NA,NA,NA,NA,NA,NA,NA,NA,NA,NA,NA,NA
Inpatient Rehabilitation Services,"New patient office of other outpatient visit, typically 60 min",99205,NA,NA,NA,NA,NA,NA,NA,NA,NA,NA,NA,NA,NA,NA,NA,NA,NA,NA,NA,NA,NA,NA,NA,NA,NA,NA,NA,NA,NA,NA,NA,NA,NA,NA,NA,NA,NA,NA,NA,NA,NA,NA,NA,NA,NA,NA,NA,NA
Inpatient Rehabilitation Services,"Patient office consultation, typically 40 min",99243,NA,NA,NA,NA,NA,NA,NA,NA,NA,NA,NA,NA,NA,NA,NA,NA,NA,NA,NA,NA,NA,NA,NA,NA,NA,NA,NA,NA,NA,NA,NA,NA,NA,NA,NA,NA,NA,NA,NA,NA,NA,NA,NA,NA,NA,NA,NA,NA
Inpatient Rehabilitation Services,"Patient office consultation, typically 60 min",99244,NA,NA,NA,NA,NA,NA,NA,NA,NA,NA,NA,NA,NA,NA,NA,NA,NA,NA,NA,NA,NA,NA,NA,NA,NA,NA,NA,NA,NA,NA,NA,NA,NA,NA,NA,NA,NA,NA,NA,NA,NA,NA,NA,NA,NA,NA,NA,NA
Inpatient Rehabilitation Services,"Initial new patient preventive medicine evaluation, for those ages 18 to 39",99385,NA,NA,NA,NA,NA,NA,NA,NA,NA,NA,NA,NA,NA,NA,NA,NA,NA,NA,NA,NA,NA,NA,NA,NA,NA,NA,NA,NA,NA,NA,NA,NA,NA,NA,NA,NA,NA,NA,NA,NA,NA,NA,NA,NA,NA,NA,NA,NA
Inpatient Rehabilitation Services,"Initial new patient preventive medicine evaluation, for those ages 40 to 64",99386,NA,NA,NA,NA,NA,NA,NA,NA,NA,NA,NA,NA,NA,NA,NA,NA,NA,NA,NA,NA,NA,NA,NA,NA,NA,NA,NA,NA,NA,NA,NA,NA,NA,NA,NA,NA,NA,NA,NA,NA,NA,NA,NA,NA,NA,NA,NA,NA
Inpatient Rehabilitation Services,Inpatient Rehab Per Discharge: Stroke,CMG 0101-A,NA,NA,$12764.70,$15452.00,NA,NA,NA,NA,NA,NA,NA,NA,NA,NA,NA,NA,NA,NA,$13436.52,NA,NA,NA,NA,NA,NA,$13436.52,NA,NA,NA,NA,NA,NA,$13436.52,NA,$13436.52,NA,NA,$15452.00,$13436.52,NA,$13436.52,$13436.52,NA,$12764.70,NA,NA,NA,NA
Inpatient Rehabilitation Services,Inpatient Rehab Per Discharge: Stroke,CMG 0101-B,NA,NA,$16814.19,$20354.02,NA,NA,NA,NA,NA,NA,NA,NA,NA,NA,NA,NA,NA,NA,$17699.14,NA,NA,NA,NA,NA,NA,$17699.14,NA,NA,NA,NA,NA,NA,$17699.14,NA,$17699.14,NA,NA,$20354.02,$17699.14,NA,$17699.14,$17699.14,NA,$16814.19,NA,NA,NA,NA
Inpatient Rehabilitation Services,Inpatient Rehab Per Discharge: Stroke,CMG 0101-C,NA,NA,$14375.36,$17401.76,NA,NA,NA,NA,NA,NA,NA,NA,NA,NA,NA,NA,NA,NA,$15131.96,NA,NA,NA,NA,NA,NA,$15131.96,NA,NA,NA,NA,NA,NA,$15131.96,NA,$15131.96,NA,NA,$17401.76,$15131.96,NA,$15131.96,$15131.96,NA,$14375.36,NA,NA,NA,NA
Inpatient Rehabilitation Services,Inpatient Rehab Per Discharge: Stroke,CMG 0101-D,NA,NA,$13338.54,$16146.65,NA,NA,NA,NA,NA,NA,NA,NA,NA,NA,NA,NA,NA,NA,$14040.57,NA,NA,NA,NA,NA,NA,$14040.57,NA,NA,NA,NA,NA,NA,$14040.57,NA,$14040.57,NA,NA,$16146.65,$14040.57,NA,$14040.57,$14040.57,NA,$13338.54,NA,NA,NA,NA
Inpatient Rehabilitation Services,Inpatient Rehab Per Discharge: Stroke,CMG 0102-A,NA,NA,$16303.92,$19736.33,NA,NA,NA,NA,NA,NA,NA,NA,NA,NA,NA,NA,NA,NA,$17162.03,NA,NA,NA,NA,NA,NA,$17162.03,NA,NA,NA,NA,NA,NA,$17162.03,NA,$17162.03,NA,NA,$19736.33,$17162.03,NA,$17162.03,$17162.03,NA,$16303.92,NA,NA,NA,NA
Inpatient Rehabilitation Services,Inpatient Rehab Per Discharge: Stroke,CMG 0102-B,NA,NA,$21476.64,$25998.04,NA,NA,NA,NA,NA,NA,NA,NA,NA,NA,NA,NA,NA,NA,$22606.99,NA,NA,NA,NA,NA,NA,$22606.99,NA,NA,NA,NA,NA,NA,$22606.99,NA,$22606.99,NA,NA,$25998.04,$22606.99,NA,$22606.99,$22606.99,NA,$21476.64,NA,NA,NA,NA
Inpatient Rehabilitation Services,Inpatient Rehab Per Discharge: Stroke,CMG 0102-C,NA,NA,$18359.64,$22224.83,NA,NA,NA,NA,NA,NA,NA,NA,NA,NA,NA,NA,NA,NA,$19325.94,NA,NA,NA,NA,NA,NA,$19325.94,NA,NA,NA,NA,NA,NA,$19325.94,NA,$19325.94,NA,NA,$22224.83,$19325.94,NA,$19325.94,$19325.94,NA,$18359.64,NA,NA,NA,NA
Inpatient Rehabilitation Services,Inpatient Rehab Per Discharge: Stroke,CMG 0102-D,NA,NA,$17037.53,$20624.38,NA,NA,NA,NA,NA,NA,NA,NA,NA,NA,NA,NA,NA,NA,$17934.24,NA,NA,NA,NA,NA,NA,$17934.24,NA,NA,NA,NA,NA,NA,$17934.24,NA,$17934.24,NA,NA,$20624.38,$17934.24,NA,$17934.24,$17934.24,NA,$17037.53,NA,NA,NA,NA
Inpatient Rehabilitation Services,Inpatient Rehab Per Discharge: Stroke,CMG 0103-A,NA,NA,$20849.00,$25238.27,NA,NA,NA,NA,NA,NA,NA,NA,NA,NA,NA,NA,NA,NA,$21946.32,NA,NA,NA,NA,NA,NA,$21946.32,NA,NA,NA,NA,NA,NA,$21946.32,NA,$21946.32,NA,NA,$25238.27,$21946.32,NA,$21946.32,$21946.32,NA,$20849.00,NA,NA,NA,NA
Inpatient Rehabilitation Services,Inpatient Rehab Per Discharge: Stroke,CMG 0103-B,NA,NA,$27462.85,$33244.50,NA,NA,NA,NA,NA,NA,NA,NA,NA,NA,NA,NA,NA,NA,$28908.26,NA,NA,NA,NA,NA,NA,$28908.26,NA,NA,NA,NA,NA,NA,$28908.26,NA,$28908.26,NA,NA,$33244.50,$28908.26,NA,$28908.26,$28908.26,NA,$27462.85,NA,NA,NA,NA
Inpatient Rehabilitation Services,Inpatient Rehab Per Discharge: Stroke,CMG 0103-C,NA,NA,$23476.93,$28419.45,NA,NA,NA,NA,NA,NA,NA,NA,NA,NA,NA,NA,NA,NA,$24712.56,NA,NA,NA,NA,NA,NA,$24712.56,NA,NA,NA,NA,NA,NA,$24712.56,NA,$24712.56,NA,NA,$28419.45,$24712.56,NA,$24712.56,$24712.56,NA,$23476.93,NA,NA,NA,NA
Inpatient Rehabilitation Services,Inpatient Rehab Per Discharge: Stroke,CMG 0103-D,NA,NA,$21784.76,$26371.02,NA,NA,NA,NA,NA,NA,NA,NA,NA,NA,NA,NA,NA,NA,$22931.32,NA,NA,NA,NA,NA,NA,$22931.32,NA,NA,NA,NA,NA,NA,$22931.32,NA,$22931.32,NA,NA,$26371.02,$22931.32,NA,$22931.32,$22931.32,NA,$21784.76,NA,NA,NA,NA
Inpatient Rehabilitation Services,Inpatient Rehab Per Discharge: Stroke,CMG 0104-A,NA,NA,$27086.26,$32788.63,NA,NA,NA,NA,NA,NA,NA,NA,NA,NA,NA,NA,NA,NA,$28511.86,NA,NA,NA,NA,NA,NA,$28511.86,NA,NA,NA,NA,NA,NA,$28511.86,NA,$28511.86,NA,NA,$32788.63,$28511.86,NA,$28511.86,$28511.86,NA,$27086.26,NA,NA,NA,NA
Inpatient Rehabilitation Services,Inpatient Rehab Per Discharge: Stroke,CMG 0104-B,NA,NA,$35679.20,$43190.61,NA,NA,NA,NA,NA,NA,NA,NA,NA,NA,NA,NA,NA,NA,$37557.05,NA,NA,NA,NA,NA,NA,$37557.05,NA,NA,NA,NA,NA,NA,$37557.05,NA,$37557.05,NA,NA,$43190.61,$37557.05,NA,$37557.05,$37557.05,NA,$35679.20,NA,NA,NA,NA
Inpatient Rehabilitation Services,Inpatient Rehab Per Discharge: Stroke,CMG 0104-C,NA,NA,$30501.59,$36922.98,NA,NA,NA,NA,NA,NA,NA,NA,NA,NA,NA,NA,NA,NA,$32106.94,NA,NA,NA,NA,NA,NA,$32106.94,NA,NA,NA,NA,NA,NA,$32106.94,NA,$32106.94,NA,NA,$36922.98,$32106.94,NA,$32106.94,$32106.94,NA,$30501.59,NA,NA,NA,NA
Inpatient Rehabilitation Services,Inpatient Rehab Per Discharge: Stroke,CMG 0104-D,NA,NA,$28302.41,$34260.82,NA,NA,NA,NA,NA,NA,NA,NA,NA,NA,NA,NA,NA,NA,$29792.01,NA,NA,NA,NA,NA,NA,$29792.01,NA,NA,NA,NA,NA,NA,$29792.01,NA,$29792.01,NA,NA,$34260.82,$29792.01,NA,$29792.01,$29792.01,NA,$28302.41,NA,NA,NA,NA
