Hospital Name,Category,ServiceCode,ServiceName,ServicePrice,State
Elliot Hospital,Emergency Care,HCPCS 99291,"Emergency Critical Care, First 30 Minutes","$2,351.82",NH
Elliot Hospital,Emergency Care,HCPCS 99281,Emergency Level 1,"$1,121.73",NH
Elliot Hospital,Emergency Care,HCPCS 99282,Emergency Level 2,"$1,121.73",NH
Elliot Hospital,Emergency Care,HCPCS 99283,Emergency Level 3,"$1,121.73",NH
Elliot Hospital,Emergency Care,HCPCS 99284,Emergency Level 4,"$1,121.73",NH
Elliot Hospital,Emergency Care,HCPCS 99285,Emergency Level 5,"$1,121.73",NH
Elliot Hospital,Office Visit,HCPCS 99204,"New patient office of other outpatient visit, typically 45 min",$134.24,NH
Elliot Hospital,Office Visit,HCPCS 99205,"New patient office of other outpatient visit, typically 60 min",$134.24,NH
Elliot Hospital,Office Visit,HCPCS 99203,"New patient office or other outpatient visit, typically 30 min",$134.24,NH
Elliot Hospital,Speech,HCPCS 92523,Evaluation of Speech Sound Production and Language Comprehenson,$176.83,NH
Elliot Hospital,Speech,HCPCS 92507,Speech Therapy,$132.08,NH
Elliot Hospital,Speech,HCPCS 92610,Swallow Evaluation,$228.17,NH
Elliot Hospital,Speech,HCPCS 92526,Swallow Treatment,$140.66,NH
Elliot Hospital,Blood,HCPCS 85018,"Blood count, hemoglobin",$18.97,NH
Elliot Hospital,Blood,HCPCS 85014,"Blood count, hemoglobin and hematocrit",$18.97,NH
Elliot Hospital,Blood,HCPCS 82950,Blood glucose (sugar) level after receiving dose of glucose,$28.08,NH
Elliot Hospital,Blood,HCPCS 82951,Blood glucose (sugar) tolerance test,$28.08,NH
Elliot Hospital,Blood,HCPCS 85610,"Blood test, clotting time",$29.51,NH
Elliot Hospital,Blood,HCPCS 85730,Coagulation assessment blood test,$40.98,NH
Elliot Hospital,Blood,HCPCS 85611,Coagulation Function Measurement; D-dimer; quantitative,$29.51,NH
Elliot Hospital,Blood,HCPCS 85025,"Complete blood cell count, with differential white blood cells, automated",$40.41,NH
Elliot Hospital,Blood,HCPCS 85027,"Complete blood count, automated",$40.41,NH
Elliot Hospital,Blood,HCPCS 85007,Microscopic examination for white blood cells with manual cell count,$18.50,NH
Elliot Hospital,Blood,HCPCS 85303,Protein C antigen (clotting inhibitor) measurement,$101.52,NH
Elliot Hospital,Blood,HCPCS 85660,Red blood cell sickling measurement,$61.61,NH
Elliot Hospital,Blood,HCPCS 85041,"Red blood count, automated test",$27.62,NH
Elliot Hospital,Chemistry,HCPCS 84588,ADH (antidiuretic hormone) level,$133.43,NH
Elliot Hospital,Chemistry,HCPCS 82024,Adrenocorticotropic hormone (ACTH) level,$174.32,NH
Elliot Hospital,Chemistry,HCPCS 82040,Albumin (protein) level,$44.25,NH
Elliot Hospital,Chemistry,HCPCS 82103,Alpha-1-antitrypsin; total,$66.19,NH
Elliot Hospital,Chemistry,HCPCS 82105,"Alpha-Fetoprotein (AFP) Level, Serum",$86.59,NH
Elliot Hospital,Chemistry,HCPCS 82140,Ammonia level,$66.42,NH
Elliot Hospital,Chemistry,HCPCS 82150,Amylase (enzyme) level,$54.91,NH
Elliot Hospital,Chemistry,HCPCS 82164,Angiotensin l - converting enzyme (ACE) level,$66.47,NH
Elliot Hospital,Chemistry,HCPCS 82803,Arterial Blood Gases Measurement,$106.50,NH
Elliot Hospital,Chemistry,HCPCS 84439,Assay of free thyroxine,$46.51,NH
Elliot Hospital,Chemistry,HCPCS 82232,Beta-2 microglobulin (protein) level,$68.82,NH
Elliot Hospital,Chemistry,HCPCS 82248,Bilirubin level (Direct),$24.40,NH
Elliot Hospital,Chemistry,HCPCS 82247,Bilirubin level (Total),$24.40,NH
Elliot Hospital,Chemistry,HCPCS 82565,Blood creatinine level,$25.75,NH
Elliot Hospital,Chemistry,HCPCS 82947,Blood glucose (sugar) level,$19.04,NH
Elliot Hospital,Chemistry,HCPCS 84132,Blood potassium level,$20.49,NH
Elliot Hospital,Chemistry,HCPCS 84295,Blood sodium level,$23.19,NH
Elliot Hospital,Chemistry,HCPCS 84478,"Blood test, lipids (cholesterol and triglycerides)",$23.61,NH
Elliot Hospital,Chemistry,HCPCS 84443,"Blood test, thyroid stimulating hormone (TSH)",$67.42,NH
Elliot Hospital,Chemistry,HCPCS 82310,Calcium level,$27.07,NH
Elliot Hospital,Chemistry,HCPCS 82374,Carbon dioxide (bicarbonate) level,$23.40,NH
Elliot Hospital,Chemistry,HCPCS 82378,Carcinoembryonic antigen (CEA) protein level,$80.65,NH
Elliot Hospital,Chemistry,HCPCS 82465,Cholesterol level,$24.54,NH
Elliot Hospital,Chemistry,HCPCS 82525,Copper level,$70.09,NH
Elliot Hospital,Chemistry,HCPCS 82533,Cortisol Measurement,$75.84,NH
Elliot Hospital,Chemistry,HCPCS 84681,C-peptide (protein) level,$78.21,NH
Elliot Hospital,Chemistry,HCPCS 82550,Creatine kinase Level (cardiac enzyme) - Total,$47.05,NH
Elliot Hospital,Chemistry,HCPCS 82607,Cyanocobalamin (vitamin B-12) level,$79.46,NH
Elliot Hospital,Chemistry,HCPCS 82626,Dehydroepiandrosterone (DHEA-S) hormone level,$112.16,NH
Elliot Hospital,Chemistry,HCPCS 82652,"Dihydroxyvitamin D, 1, 25 level",$173.67,NH
Elliot Hospital,Chemistry,HCPCS 82728,Ferritin (blood protein) level,$69.81,NH
Elliot Hospital,Chemistry,HCPCS 82746,Folic acid; serum,$67.56,NH
Elliot Hospital,Chemistry,HCPCS 82784,Gammaglobulin Measurement,$57.48,NH
Elliot Hospital,Chemistry,HCPCS 82977,Glutamyltransferase (liver enzyme) level,$35.68,NH
Elliot Hospital,Chemistry,HCPCS 83036,Glycosylated hemoglobin test,$40.43,NH
Elliot Hospital,Chemistry,HCPCS 83001,"Gonadotropin, follicle stimulating (reproductive hormone) level",$81.71,NH
Elliot Hospital,Chemistry,HCPCS 83002,Gonadotropin (reproductive hormone) analysis,$76.99,NH
Elliot Hospital,Chemistry,HCPCS 83010,Haptoglobin (serum protein) level,$64.78,NH
Elliot Hospital,Chemistry,HCPCS 83718,HDL cholesterol level,$38.77,NH
Elliot Hospital,Chemistry,HCPCS 83020,Hemoglobin Measurement,$65.34,NH
Elliot Hospital,Chemistry,HCPCS 83090,Homocysteine (amino acid) level,$88.53,NH
Elliot Hospital,Chemistry,HCPCS 83498,"Hydroxyprogesterone, 17-D (synthetic hormone) level",$105.23,NH
Elliot Hospital,Chemistry,HCPCS 83520,Immunoassay other than infectious agent antibody,$88.68,NH
Elliot Hospital,Chemistry,HCPCS 83525,Insulin Measurement; Total,$53.57,NH
Elliot Hospital,Chemistry,HCPCS 82330,Ionized Calcium,$27.07,NH
Elliot Hospital,Chemistry,HCPCS 83550,Iron Binding Capacity,$46.89,NH
Elliot Hospital,Chemistry,HCPCS 83540,Iron level,$33.51,NH
Elliot Hospital,Chemistry,HCPCS 83615,Lactate dehydrogenase (enzyme) level,$27.86,NH
Elliot Hospital,Chemistry,HCPCS 83721,LDL cholesterol level,$44.50,NH
Elliot Hospital,Chemistry,HCPCS 83690,Lipase (fat enzyme) level,$41.04,NH
Elliot Hospital,Chemistry,HCPCS 84450,"Liver enzyme (SGOT), level",$31.58,NH
Elliot Hospital,Chemistry,HCPCS 84480,"Liver enzyme (SGPT), level",$70.25,NH
Elliot Hospital,Chemistry,HCPCS 83021,Liver function blood test panel,$65.34,NH
Elliot Hospital,Chemistry,HCPCS 83735,Magnesium Level,$41.00,NH
Elliot Hospital,Chemistry,HCPCS 82542,Mass spectrometry,$211.26,NH
Elliot Hospital,Chemistry,HCPCS 83883,"Nephelometry, test method using light",$62.54,NH
Elliot Hospital,Chemistry,HCPCS 83918,Organic acid level,$112.95,NH
Elliot Hospital,Chemistry,HCPCS 83945,Oxalate level,$80.33,NH
Elliot Hospital,Chemistry,HCPCS 83970,Parathormone,$156.05,NH
Elliot Hospital,Chemistry,HCPCS 84157,Prealbumin (protein) level,$31.34,NH
Elliot Hospital,Chemistry,HCPCS 83519,Procalcitonin (hormone) level,$88.68,NH
Elliot Hospital,Chemistry,HCPCS 84146,Prolactin (milk producing hormone) level,$84.28,NH
Elliot Hospital,Chemistry,HCPCS 84165,"Protein Measurement, Serum",$31.34,NH
Elliot Hospital,Chemistry,HCPCS 82270,Stool analysis for blood,$28.76,NH
Elliot Hospital,Chemistry,HCPCS 84403,Testosterone (hormone) level,$97.81,NH
Elliot Hospital,Chemistry,HCPCS 84402,Testosterone Level; Free,$97.81,NH
Elliot Hospital,Chemistry,HCPCS 84479,"Thyroid hormone, T3 measurement - Total",$43.20,NH
Elliot Hospital,Chemistry,HCPCS 84445,Thyroid stimulating immune globulins (thyroid related protein) level,$236.43,NH
Elliot Hospital,Chemistry,HCPCS 84436,Thyroxine (thyroid chemical) measurement - Free Thyroxine,$46.51,NH
Elliot Hospital,Chemistry,HCPCS 84155,"Total protein level, blood",$31.34,NH
Elliot Hospital,Chemistry,HCPCS 84156,"Total Protein Level, Urine",$31.34,NH
Elliot Hospital,Chemistry,HCPCS 84166,Troponin (protein) analysis,$31.34,NH
Elliot Hospital,Chemistry,HCPCS 84550,"Uric acid level, blood",$19.46,NH
Elliot Hospital,Chemistry,HCPCS 82340,Urine calcium level,$27.07,NH
Elliot Hospital,Chemistry,HCPCS 82436,Urine chloride level,$27.68,NH
Elliot Hospital,Chemistry,HCPCS 82043,Urine microalbumin (protein) level,$44.25,NH
Elliot Hospital,Chemistry,HCPCS 83935,Urine osmolality (concentration) measurement,$41.71,NH
Elliot Hospital,Chemistry,HCPCS 84120,Urine porphyrins (metabolism substance) measurement,$74.25,NH
Elliot Hospital,Chemistry,HCPCS 84133,Urine potassium level,$20.49,NH
Elliot Hospital,Chemistry,HCPCS 84300,Urine sodium level,$23.19,NH
Elliot Hospital,Chemistry,HCPCS 84591,Vitamin B-6 level,$61.39,NH
Elliot Hospital,Chemistry,HCPCS 82306,Vitamin D; 25 hydroxy,$128.47,NH
Elliot Hospital,Chemistry,HCPCS 84630,Zinc level,$77.35,NH
Elliot Hospital,Immunology,HCPCS 86618,Analysis for antibody Borrelia burgdorferi (Lyme disease bacteria),$92.66,NH
Elliot Hospital,Immunology,HCPCS 86644,Analysis for antibody (IgM) to Cytomegalovirus (CMV),$107.06,NH
Elliot Hospital,Immunology,HCPCS 86694,Analysis for antibody to Herpes simplex virus,$96.57,NH
Elliot Hospital,Immunology,HCPCS 86695,"Analysis for antibody to Herpes simplex virus, type 1",$96.57,NH
Elliot Hospital,Immunology,HCPCS 86701,Analysis for antibody to HIV -1 virus,$93.11,NH
Elliot Hospital,Immunology,HCPCS 86803,Confirmation test for Hepatitis C antibody,$71.32,NH
Elliot Hospital,Immunology,HCPCS 86225,Deoxyribonucleic acid (DNA) antibody; native or double stranded,$83.02,NH
Elliot Hospital,Immunology,HCPCS 86704,Hepatitis B core antibody (IgM) measurement,$71.32,NH
Elliot Hospital,Immunology,HCPCS 86706,Hepatitis B surface antibody measurement,$71.32,NH
Elliot Hospital,Immunology,HCPCS 86317,Immunoassay for infectious agent antibody,$106.25,NH
Elliot Hospital,Immunology,HCPCS 86334,Immunofixation electrophoresis; serum,$96.75,NH
Elliot Hospital,Immunology,HCPCS 86140,Measurement C-reactive protein,$50.24,NH
Elliot Hospital,Immunology,HCPCS 86003,Measurement of antibody (IgE) to allergic substance,$26.25,NH
Elliot Hospital,Immunology,HCPCS 86255,Measurement of antibody to noninfectious agent,$143.98,NH
Elliot Hospital,Immunology,HCPCS 86161,Measurement of complement (immune system proteins),$114.94,NH
Elliot Hospital,Immunology,HCPCS 86708,Measurement of Hepatitis A antibody (IgM),$71.32,NH
Elliot Hospital,Immunology,HCPCS 86376,Microsomal Antibodies Measurement,$100.35,NH
Elliot Hospital,Immunology,HCPCS 86308,Screening test for mononucleosis (mono),$38.29,NH
Elliot Hospital,Immunology,HCPCS 86580,Skin test for tuberculosis,$24.75,NH
Elliot Hospital,Immunology,HCPCS 86592,Syphilis Detection Test,$33.16,NH
Elliot Hospital,Immunology,HCPCS 86360,"T cells; absolute CD4 and CD8 count, including ratio",$102.15,NH
Elliot Hospital,Immunology,HCPCS 86359,"T cells count, total",$102.15,NH
Elliot Hospital,Microbiology,HCPCS 87070,"Bacterial Culture, any source ",$58.57,NH
Elliot Hospital,Microbiology,HCPCS 87086,Bacterial urine culture; quantitative colony count,$39.35,NH
Elliot Hospital,Microbiology,HCPCS 87491,Chlamydia Test,$115.60,NH
Elliot Hospital,Microbiology,HCPCS 87635,Covid-19 current infection test,$87.75,NH
Elliot Hospital,Microbiology,HCPCS 87493,Detection test for clostridium difficile,$110.50,NH
Elliot Hospital,Microbiology,HCPCS 87497,"Detection test for cytomegalovirus, quantification",$205.58,NH
Elliot Hospital,Microbiology,HCPCS 87340,Detection test for Hepatitis Be surface antigen,$71.32,NH
Elliot Hospital,Microbiology,HCPCS 87536,"Detection test for HIV-1 virus, quantification",$281.43,NH
Elliot Hospital,Microbiology,HCPCS 87591,Detection Test for Neisseria Gonorrhoeae,$115.60,NH
Elliot Hospital,Microbiology,HCPCS 87517,Hepatitis B Detection,$259.59,NH
Elliot Hospital,Microbiology,HCPCS 87389,HIV antigen and antibodies detection test,$93.11,NH
Elliot Hospital,Microbiology,HCPCS 87624,HPV Detection,$96.15,NH
Elliot Hospital,Microbiology,HCPCS 87230,Microbial toxin or antitoxin assay,$91.35,NH
Elliot Hospital,Microbiology,HCPCS 86735,Mumps virus antibody test,$61.20,NH
Elliot Hospital,Microbiology,HCPCS 86747,Parvovirus antibody test,$70.20,NH
Elliot Hospital,Microbiology,HCPCS 86762,Rubella virus antibody test,$72.00,NH
Elliot Hospital,Microbiology,HCPCS 86765,Rubeola virus antibody test,$51.75,NH
Elliot Hospital,Microbiology,HCPCS 87177,Smear for Parasites,$51.32,NH
Elliot Hospital,Microbiology,HCPCS 87206,Special stain for microorganism; special stain for parasites,$27.61,NH
Elliot Hospital,Microbiology,HCPCS 87045,Stool Culture,$42.20,NH
Elliot Hospital,Microbiology,HCPCS 87880,Strep Test,$47.13,NH
Elliot Hospital,Microbiology,HCPCS 87804,Test for Influenza Virus,$56.50,NH
Elliot Hospital,Microbiology,HCPCS 86787,Varicella-zoster virus antibody test,$60.30,NH
Elliot Hospital,Molecular pathology,HCPCS 81256,Gene analysis (hemochromatosis) common variants,$187.61,NH
Elliot Hospital,Organ or Disease Oriented Panels,HCPCS 80074,Acute hepatitis panel,$224.54,NH
Elliot Hospital,Organ or Disease Oriented Panels,HCPCS 80048,Basic metabolic panel,$41.61,NH
Elliot Hospital,Organ or Disease Oriented Panels,HCPCS 80053,"Blood test, comprehensive group of blood chemicals",$47.23,NH
Elliot Hospital,Organ or Disease Oriented Panels,HCPCS 80061,"Blood test, lipids (cholesterol and triglycerides)",$65.21,NH
Elliot Hospital,Organ or Disease Oriented Panels,HCPCS 80069,Kidney Function Blood Test Panel,$39.00,NH
Elliot Hospital,Organ or Disease Oriented Panels,HCPCS 80076,Liver function blood test panel,$50.12,NH
Elliot Hospital,Organ or Disease Oriented Panels,HCPCS 80055,Obstetric blood test panel,$244.04,NH
Elliot Hospital,Surgical Pathology,HCPCS 88312,Special Stain for Microorganism; Gram or Glemsa Stain,$159.84,NH
Elliot Hospital,Therapeutic Drug Assays,HCPCS 80158,Cyclosporine level,$96.48,NH
Elliot Hospital,Therapeutic Drug Assays,HCPCS 80162,Digoxin level,$62.82,NH
Elliot Hospital,Therapeutic Drug Assays,HCPCS 80307,Drug Test(s) by Chemistry Analyzer,$231.70,NH
Elliot Hospital,Therapeutic Drug Assays,HCPCS 80177,Levetiracetam level,$87.89,NH
Elliot Hospital,Therapeutic Drug Assays,HCPCS 80178,Lithium Level,$42.41,NH
Elliot Hospital,Therapeutic Drug Assays,HCPCS 80184,Phenobarbital level,$56.78,NH
Elliot Hospital,Therapeutic Drug Assays,HCPCS 80185,Phenytoin level,$51.51,NH
Elliot Hospital,Therapeutic Drug Assays,HCPCS 80197,Tacrolimus Level,$45.31,NH
Elliot Hospital,Therapeutic Drug Assays,HCPCS 80164,Valproic acid level,$61.27,NH
Elliot Hospital,Therapeutic Drug Assays,HCPCS 80202,Vancomycin (antibiotic) level,$57.12,NH
Elliot Hospital,Transfusion,HCPCS 86900,"Blood Typing, ABO",$22.86,NH
Elliot Hospital,Transfusion,HCPCS 86901,"Blood Typing, Rh (D)",$22.86,NH
Elliot Hospital,Transfusion,HCPCS 86922,Blood Unit Compatibility Test; Antiglobulin Technique,$62.78,NH
Elliot Hospital,Transfusion,HCPCS 86880,Red blood cell (RBC) antibody detection test,$44.45,NH
Elliot Hospital,Transfusion,HCPCS 86850,Screening test for red blood cell (RBC) antibodies,$44.45,NH
Elliot Hospital,Urinalysis,HCPCS 81003,"Urinalysis, Automated Test",$25.28,NH
Elliot Hospital,Urinalysis,HCPCS 81001,"Urinalysis with Examination, using Microscope",$25.28,NH
Elliot Hospital,Urinalysis,HCPCS 81025,Urine Pregnancy Test,$25.55,NH
Elliot Hospital,Cardiovascular,HCPCS 93017,"Cardiovascular stress test, without interpretation and report",$681.23,NH
Elliot Hospital,Cardiovascular,HCPCS 93000,"Electrocardiogram, routine, with interpretation and report",$96.97,NH
Elliot Hospital,Cardiovascular,HCPCS 93005,"Electrocardiogram, tracing only, without interpretation and report",$96.97,NH
Elliot Hospital,Cardiovascular,HCPCS 93041,Heart rhythm symptom-related tracing of 24-hour EKG monitoring up to 30 days,$96.97,NH
Elliot Hospital,Cardiovascular,HCPCS 93226,Holter Testing - 48-Hour EKG,$224.64,NH
Elliot Hospital,Cardiovascular,HCPCS 93660,Tilt table test to evaluate heart (for unexplained fainting),$836.24,NH
Elliot Hospital,Cardiovascular,HCPCS 93975,Ultrasound Heart,$606.70,NH
Elliot Hospital,Pulmonary,HCPCS 94640,Aerosol Treatment,$169.44,NH
Elliot Hospital,Pulmonary,HCPCS 94618,Pulmonary stress test,$289.69,NH
Elliot Hospital,Pulmonary,HCPCS 94010,Spirometry - breathing test,$442.34,NH
Elliot Hospital,Sleep,HCPCS 95810,Sleep study,"$3,402.21",NH
Elliot Hospital,Breast,HCPCS 77065,"Diagnostic mammography, unilateral",$341.29,NH
Elliot Hospital,Breast,HCPCS 77067,Mammogram Screening,$328.49,NH
Elliot Hospital,Breast,HCPCS 77066,Mammography of both breasts,$341.29,NH
Elliot Hospital,CT Scan,HCPCS 71275,CT Angiogram Chest with and without Contrast,"$1,536.42",NH
Elliot Hospital,CT Scan,HCPCS 74150,CT scan Abdomen without Contrast,$987.54,NH
Elliot Hospital,CT Scan,HCPCS 70450,"CT scan, head or brain, without contrast",$699.00,NH
Elliot Hospital,CT Scan,HCPCS 70486,"CT scan, maxillofacial area; without contrast material",$672.91,NH
Elliot Hospital,CT Scan,HCPCS 74178,CT scan of abdomen & pelvis with and without contrast material,"$2,242.30",NH
Elliot Hospital,CT Scan,HCPCS 74177,CT scan of abdomen & pelvis with contrast material,"$2,242.30",NH
Elliot Hospital,CT Scan,HCPCS 74176,CT scan of abdomen & pelvis without contrast material,"$1,723.17",NH
Elliot Hospital,CT Scan,HCPCS 74160,CT scan of abdomen with contrast material,"$1,329.82",NH
Elliot Hospital,CT Scan,HCPCS 74170,CT scan of abdomen without & with contrast material,"$1,329.82",NH
Elliot Hospital,CT Scan,HCPCS 71260,"CT Scan of thorax, with contrast material","$1,171.18",NH
Elliot Hospital,CT Scan,HCPCS 71250,"CT Scan of thorax, without contrast material","$1,038.52",NH
Elliot Hospital,CT Scan,HCPCS 72193,"CT scan, pelvis, with contrast","$1,168.13",NH
Elliot Hospital,CT Scan,HCPCS 70491,"CT scan, soft tissue neck; with contrast material(s)",$974.77,NH
Elliot Hospital,MRA,HCPCS 70544,"Magnetic resonance angiography, head; without contrast material(s)","$1,367.15",NH
Elliot Hospital,MRI,HCPCS 72146,MRI chest spine without contrast material,"$1,633.72",NH
Elliot Hospital,MRI,HCPCS 72148,MRI lumbar spine without contrast material,"$1,633.72",NH
Elliot Hospital,MRI,HCPCS 72158,MRI lumbar spine without & with contrast material,"$2,578.65",NH
Elliot Hospital,MRI,HCPCS 72141,MRI neck spine without contrast material,"$1,633.72",NH
Elliot Hospital,MRI,HCPCS 74183,MRI of abdomen without & with contrast material,"$2,391.04",NH
Elliot Hospital,MRI,HCPCS 73221,MRI of upper extremity joint; without contrast material,"$1,573.97",NH
Elliot Hospital,MRI,HCPCS 70553,MRI scan of brain before and after contrast,"$2,487.05",NH
Elliot Hospital,MRI,HCPCS 70551,MRI scan of brain (including brain stem); without contrast material,"$1,714.46",NH
Elliot Hospital,MRI,HCPCS 73721,MRI scan of leg joint,"$1,654.34",NH
Elliot Hospital,Ultrasound,HCPCS 76805,"Abdominal ultrasound of pregnant uterus, first trimester",$517.84,NH
Elliot Hospital,Ultrasound,HCPCS 76506,Ultrasound Blood Flow Outside the Brain,$317.70,NH
Elliot Hospital,Ultrasound,HCPCS 76770,"Ultrasound exam of abdomenal back wall, complete",$523.28,NH
Elliot Hospital,Ultrasound,HCPCS 76536,Ultrasound exam of head and neck,$401.71,NH
Elliot Hospital,Ultrasound,HCPCS 76700,"Ultrasound of abdomen, complete",$497.69,NH
Elliot Hospital,Ultrasound,HCPCS 76705,"Ultrasound of abdomen, limited",$497.69,NH
Elliot Hospital,Ultrasound,HCPCS 76857,Ultrasound of pelvis,$440.21,NH
Elliot Hospital,Ultrasound,HCPCS 76856,"Ultrasound, pelvic, complete",$440.21,NH
Elliot Hospital,Ultrasound,HCPCS 76830,"Ultrasound, transvaginal",$477.68,NH
Elliot Hospital,Ultrasound,HCPCS 76881,Ultrasound Veins of Both Arms or Legs,$385.78,NH
Elliot Hospital,Chest,HCPCS 71046,X-ray of chest; 2 Views,$182.96,NH
Elliot Hospital,Chest,HCPCS 71045,X-ray of chest; Single View,$182.96,NH
Elliot Hospital,Chest,HCPCS 71100,"X-ray Ribs One Side, 2 Views",$232.68,NH
Elliot Hospital,Head and Neck,HCPCS 70150,"X-ray of bones of face, minimum of 3 views",$216.20,NH
Elliot Hospital,Head and Neck,HCPCS 70160,"X-ray of bones of nose, minimum of 3 views",$207.90,NH
Elliot Hospital,Head and Neck,HCPCS 77076,X-ray of jaw joints on both sides of the face,$442.74,NH
Elliot Hospital,Head and Neck,HCPCS 70110,"X-ray of mandible, minimum of 4 views",$156.32,NH
Elliot Hospital,Head and Neck,HCPCS 70360,X-ray of neck soft tissue,$182.37,NH
Elliot Hospital,Head and Neck,HCPCS 70210,"X-ray of paranasal sinus, less than 3 views",$240.18,NH
Elliot Hospital,Head and Neck,HCPCS 70260,"X-ray of skull, complete, minimum of 4 views",$215.45,NH
Elliot Hospital,Hip and Pelvis,HCPCS 73522,"X-ray Both Hips and Pelvis, 3-4 Views",$259.80,NH
Elliot Hospital,Hip and Pelvis,HCPCS 73502,"X-ray Hip and Pelvis, 2 Views",$213.33,NH
Elliot Hospital,Hip and Pelvis,HCPCS 72170,"X-ray Pelvis, 1-2 Views",$185.83,NH
Elliot Hospital,Hip and Pelvis,HCPCS 72202,"X-ray Sacroiliac Joints, 3 or More Views",$222.15,NH
Elliot Hospital,Lower Limbs,HCPCS 73600,"X-ray Ankle, 2 Views",$229.91,NH
Elliot Hospital,Lower Limbs,HCPCS 73610,"X-ray Ankle, 3 Views",$229.91,NH
Elliot Hospital,Lower Limbs,HCPCS 73565,X-ray Both Knees,$297.66,NH
Elliot Hospital,Lower Limbs,HCPCS 73630,X-ray exam of foot,$229.91,NH
Elliot Hospital,Lower Limbs,HCPCS 73562,"X-ray exam of knee, 3 views",$297.66,NH
Elliot Hospital,Lower Limbs,HCPCS 73552,"X-ray Femur, 2 Views",$207.61,NH
Elliot Hospital,Lower Limbs,HCPCS 73620,"X-ray Foot, 2 Views",$229.91,NH
Elliot Hospital,Lower Limbs,HCPCS 73650,"X-ray Heel, 2 Views",$184.89,NH
Elliot Hospital,Lower Limbs,HCPCS 73560,"X-ray Knee, 1-2 Views",$297.66,NH
Elliot Hospital,Lower Limbs,HCPCS 73564,"X-ray Knee, 4 or More Views",$297.66,NH
Elliot Hospital,Lower Limbs,HCPCS 73590,"X-ray Lower Leg, 2 Views",$207.76,NH
Elliot Hospital,Spine,HCPCS 72110,"X-ray, lower back, minimum four views",$273.32,NH
Elliot Hospital,Spine,HCPCS 72100,"X-ray Lower Sacral Spine, 2 or 3 views",$273.32,NH
Elliot Hospital,Spine,HCPCS 72052,"X-ray Lower Sacral Spine, 4 or More Views",$273.67,NH
Elliot Hospital,Spine,HCPCS 72040,"X-ray Neck Spine, 2-3 Views",$273.67,NH
Elliot Hospital,Upper Limbs,HCPCS 73080,"X-ray Elbow, 3 Views",$230.88,NH
Elliot Hospital,Upper Limbs,HCPCS 73140,"X-ray Fingers, 2 Views",$181.84,NH
Elliot Hospital,Upper Limbs,HCPCS 73090,"X-ray Forearm, 2 Views",$200.89,NH
Elliot Hospital,Upper Limbs,HCPCS 73120,"X-ray Hand, 2 Views",$218.70,NH
Elliot Hospital,Upper Limbs,HCPCS 73130,"X-ray Hand, 3 Views",$218.70,NH
Elliot Hospital,Upper Limbs,HCPCS 73030,"X-ray Shoulder, 2 Views",$224.28,NH
Elliot Hospital,Upper Limbs,HCPCS 73100,"X-ray Wrist, 3 Views",$218.70,NH
Elliot Hospital,Upper Limbs,HCPCS 73110,"X-ray Wrist, 3+ Views",$218.70,NH
Elliot Hospital,Abdomenal,HCPCS 52204,Biopsy of the bladder using an endoscope,"$5,045.10",NH
Elliot Hospital,Abdomenal,HCPCS 47562,Cholecystectomy,"$6,926.96",NH
Elliot Hospital,Abdomenal,HCPCS 47563,Cholecystectomy with cholangiography,"$6,926.96",NH
Elliot Hospital,Abdomenal,HCPCS 52353,Crushing of stone in urinary duct (ureter) using an endoscope,"$7,258.61",NH
Elliot Hospital,Abdomenal,HCPCS 52356,Crushing of stone in urinary duct (ureter) with stent using an endoscope,"$7,258.61",NH
Elliot Hospital,Abdomenal,HCPCS 52000,Diagnostic examination of the bladder and bladder canal (urethra) using an endoscope,"$4,051.89",NH
Elliot Hospital,Abdomenal,HCPCS 49505,Inguinal hernia repair (age over 5),"$4,906.53",NH
Elliot Hospital,Abdomenal,HCPCS 51702,Insertion of Indwelling Bladder Catheter,$234.56,NH
Elliot Hospital,Abdomenal,HCPCS 51701,Insertion of temporary bladder catheter,$234.56,NH
Elliot Hospital,Abdomenal,MSDRG 419,Laparoscopic cholecystectomy (Inpatient),"$17,095.06",NH
Elliot Hospital,Abdomenal,HCPCS 52648,Laser vaporization of prostate using an endoscope,"$7,363.38",NH
Elliot Hospital,Abdomenal,HCPCS 44970,Removal of appendix using an endoscope (Outpatient),"$8,038.48",NH
Elliot Hospital,Abdomenal,HCPCS 49650,Repair of groin hernia using an endoscope,"$6,427.22",NH
Elliot Hospital,Abdomenal,HCPCS 49654,Repair of incisional hernia using an endoscope,"$6,427.22",NH
Elliot Hospital,Abdomenal,HCPCS 49653,Repair of trapped hernia using an endoscope,"$6,427.22",NH
Elliot Hospital,Abdomenal,HCPCS 49507,Trapped inguinal hernia repair (age over 5),"$4,906.53",NH
Elliot Hospital,Abdomenal,HCPCS 49585,Umbilical hernia repair (age over 5),"$4,906.53",NH
Elliot Hospital,Breast,HCPCS 19325,Breast enlargement using prosthetic implant,"$8,454.41",NH
Elliot Hospital,Breast,HCPCS 19125,Excision of breast lesion,"$6,980.30",NH
Elliot Hospital,Breast,HCPCS 19120,Excision of cyst of breast,"$6,980.30",NH
Elliot Hospital,Breast,HCPCS 19301,Partial removal of breast,"$6,000.31",NH
Elliot Hospital,Breast,HCPCS 19318,Reduction mammaplasty,"$8,403.35",NH
Elliot Hospital,Breast,HCPCS 19307,Removal of breast and underarm lymph nodes,"$10,063.95",NH
Elliot Hospital,Breast,HCPCS 19303,Total removal of breast,"$10,063.95",NH
Elliot Hospital,Cardiac,MSDRG 216,Cardiac valve procedure with cardiac catheterization (major complications),"$40,966.47",NH
Elliot Hospital,Cardiac,HCPCS 93451,Diagnostic heart catheterization (right side),"$5,337.33",NH
Elliot Hospital,Cardiac,MSDRG 247,Implant drug-eluting stent,"$22,855.95",NH
Elliot Hospital,Cardiac,HCPCS 33228,Replacement of dual lead permanent pacemaker pulse generator,"$19,553.96",NH
Elliot Hospital,Digestive,HCPCS 45378,"Colonoscopy, diagnostic","$1,476.59",NH
Elliot Hospital,Digestive,HCPCS 45380,"Colonoscopy, with biopsy","$2,078.23",NH
Elliot Hospital,Digestive,HCPCS 45385,"Colonoscopy, with tumor removal (SNARE)","$2,170.29",NH
Elliot Hospital,Digestive,HCPCS 43235,EGD,"$1,352.79",NH
Elliot Hospital,Digestive,HCPCS 43239,EGD and biopsy,"$1,818.62",NH
Elliot Hospital,Digestive,HCPCS 46255,Removal of internal and external hemorrhoids,"$5,952.64",NH
Elliot Hospital,Digestive,HCPCS 46260,Removal of multiple internal and external hemorrhoid groups,"$5,952.64",NH
Elliot Hospital,Digestive,HCPCS 45391,Ultrasound of lower large bowel using an endoscope,"$1,476.59",NH
