Hospital Name,Category,ServiceCode,ServiceName,ServicePrice,State
Murphy Medical Center,Psychology,HCPCS 90847,"Family psychotherapy, including patient, 50 min",-,NC
Murphy Medical Center,Psychology,HCPCS 90846,"Family psychotherapy, not including patient, 50 min",-,NC
Murphy Medical Center,Psychology,HCPCS 90853,Group psychotherapy,-,NC
Murphy Medical Center,Psychology,HCPCS 90791,Psychiatric diagnostic evaluation,-,NC
Murphy Medical Center,Psychology,HCPCS 90832,"Psychotherapy, 30 minutes with patient",-,NC
Murphy Medical Center,Psychology,HCPCS 90834,"Psychotherapy, 45 minutes with patient",-,NC
Murphy Medical Center,Psychology,HCPCS 90837,"Psychotherapy, 60 min",-,NC
Murphy Medical Center,Blood,HCPCS 85008,Microscopic examination for white blood cells,-,NC
Murphy Medical Center,Chemistry,HCPCS 82374,Carbon dioxide (bicarbonate) level,-,NC
Murphy Medical Center,Chemistry,HCPCS 83020,Hemoglobin Measurement,-,NC
Murphy Medical Center,Chemistry,HCPCS 83915,Nucleotidase 5' (enzyme) level,-,NC
Murphy Medical Center,Chemistry,HCPCS 84060,Phosphatase (enzyme) level,-,NC
Murphy Medical Center,Chemistry,HCPCS 84479,"Thyroid hormone, T3 measurement - Total",-,NC
Murphy Medical Center,Immunology,HCPCS 86318,Covid-19 antibody test,-,NC
Murphy Medical Center,Organ or Disease Oriented Panels,HCPCS 80055,Obstetric blood test panel,-,NC
Murphy Medical Center,Cardiovascular,HCPCS 93041,Heart rhythm symptom-related tracing of 24-hour EKG monitoring up to 30 days,-,NC
Murphy Medical Center,Cardiovascular,HCPCS 93660,Tilt table test to evaluate heart (for unexplained fainting),-,NC
Murphy Medical Center,Sleep,HCPCS 95810,Sleep study,-,NC
Murphy Medical Center,Abdomenal,HCPCS 52204,Biopsy of the bladder using an endoscope,-,NC
Murphy Medical Center,Abdomenal,HCPCS 47562,Cholecystectomy,-,NC
Murphy Medical Center,Abdomenal,HCPCS 47563,Cholecystectomy with cholangiography,-,NC
Murphy Medical Center,Abdomenal,HCPCS 52353,Crushing of stone in urinary duct (ureter) using an endoscope,-,NC
Murphy Medical Center,Abdomenal,HCPCS 52356,Crushing of stone in urinary duct (ureter) with stent using an endoscope,-,NC
Murphy Medical Center,Abdomenal,HCPCS 49505,Inguinal hernia repair (age over 5),-,NC
Murphy Medical Center,Abdomenal,HCPCS 52648,Laser vaporization of prostate using an endoscope,-,NC
Murphy Medical Center,Abdomenal,HCPCS 44970,Removal of appendix using an endoscope (Outpatient),-,NC
Murphy Medical Center,Abdomenal,HCPCS 52601,Removal of prostate through bladder canal (urethra) using an endoscope,-,NC
Murphy Medical Center,Abdomenal,HCPCS 49650,Repair of groin hernia using an endoscope,-,NC
Murphy Medical Center,Abdomenal,HCPCS 49654,Repair of incisional hernia using an endoscope,-,NC
Murphy Medical Center,Abdomenal,HCPCS 49653,Repair of trapped hernia using an endoscope,-,NC
Murphy Medical Center,Abdomenal,HCPCS 50590,Shock wave crushing of kidney stones,-,NC
Murphy Medical Center,Abdomenal,HCPCS 49507,Trapped inguinal hernia repair (age over 5),-,NC
Murphy Medical Center,Abdomenal,HCPCS 49585,Umbilical hernia repair (age over 5),-,NC
Murphy Medical Center,Breast,HCPCS 19325,Breast enlargement using prosthetic implant,-,NC
Murphy Medical Center,Breast,HCPCS 19125,Excision of breast lesion,-,NC
Murphy Medical Center,Breast,HCPCS 19120,Excision of cyst of breast,-,NC
Murphy Medical Center,Breast,HCPCS 19301,Partial removal of breast,-,NC
Murphy Medical Center,Breast,HCPCS 19318,Reduction mammaplasty,-,NC
Murphy Medical Center,Breast,HCPCS 19307,Removal of breast and underarm lymph nodes,-,NC
Murphy Medical Center,Breast,HCPCS 19303,Total removal of breast,-,NC
Murphy Medical Center,Cardiac,HCPCS 33249,Defibrillator complete system,-,NC
Murphy Medical Center,Cardiac,HCPCS 33240,Defibrillator generator,-,NC
Murphy Medical Center,Cardiac,HCPCS 93452,Diagnostic heart catheterization,-,NC
Murphy Medical Center,Cardiac,HCPCS 93451,Diagnostic heart catheterization (right side),-,NC
Murphy Medical Center,Cardiac,HCPCS 33228,Replacement of dual lead permanent pacemaker pulse generator,-,NC
Murphy Medical Center,Digestive,HCPCS 45378,"Colonoscopy, diagnostic",-,NC
Murphy Medical Center,Digestive,HCPCS 45380,"Colonoscopy, with biopsy",-,NC
Murphy Medical Center,Digestive,HCPCS 45384,"Colonoscopy, with tumor removal",-,NC
Murphy Medical Center,Digestive,HCPCS 45385,"Colonoscopy, with tumor removal (SNARE)",-,NC
Murphy Medical Center,Digestive,HCPCS 43235,EGD,-,NC
Murphy Medical Center,Digestive,HCPCS 43239,EGD and biopsy,-,NC
Murphy Medical Center,Digestive,HCPCS 46255,Removal of internal and external hemorrhoids,-,NC
Murphy Medical Center,Digestive,HCPCS 46260,Removal of multiple internal and external hemorrhoid groups,-,NC
Murphy Medical Center,Digestive,HCPCS 45391,Ultrasound of lower large bowel using an endoscope,-,NC
Murphy Medical Center,Foot,HCPCS 28296,Bunionectomy or repair of toe deformities,-,NC
Murphy Medical Center,General,HCPCS 55866,Prostatectomy,-,NC
Murphy Medical Center,General,HCPCS 60240,Removal of thyroid,-,NC
Murphy Medical Center,Head,HCPCS 69436,Create eardrum opening,-,NC
Murphy Medical Center,Head,HCPCS 69930,Implantation of cochlear device,-,NC
Murphy Medical Center,Head,HCPCS 67028,Injection of drug into the eye,-,NC
Murphy Medical Center,Head,HCPCS 69631,Repair of eardrum,-,NC
Murphy Medical Center,Intraoral,HCPCS 42826,Tonsil removal (patient 12 and over),-,NC
Murphy Medical Center,Intraoral,HCPCS 42820,Tonsil removal (patient under 12),-,NC
Murphy Medical Center,Musculoskeletal,HCPCS 62323,Injection of substance into spinal canal of lower back or sacrum using imaging guidance,-,NC
Murphy Medical Center,Musculoskeletal,HCPCS 62321,Injection of substance into spinal canal of upper or middle back using imaging guidance,-,NC
Murphy Medical Center,Musculoskeletal,HCPCS 64483,Injections of anesthetic and/or steroid drug into lower or sacral spine nerve root using imaging guidance,-,NC
Murphy Medical Center,Musculoskeletal,HCPCS 27200,Insertion of Breathing Tube Using an Endoscope,-,NC
Murphy Medical Center,Musculoskeletal,HCPCS 29881,Knee arthroscopic cartilage removal,-,NC
Murphy Medical Center,Musculoskeletal,HCPCS 29877,Knee arthroscopic chrondoplasty,-,NC
Murphy Medical Center,Musculoskeletal,HCPCS 63685,Neurostimulator pulse generator,-,NC
Murphy Medical Center,Musculoskeletal,HCPCS 29824,Shoulder arthroscopy,-,NC
Murphy Medical Center,Musculoskeletal,HCPCS 22612,Spine arthrodesis,-,NC
Murphy Medical Center,Obstetrics,HCPCS 58571,Abdominal removal of uterus with removal of tubes and/or ovaries using an endoscope,-,NC
Murphy Medical Center,Obstetrics,HCPCS 58558,Biopsy and/or removal of polyp of the uterus using an endoscope,-,NC
Murphy Medical Center,Obstetrics,HCPCS 58662,Destruction or removal of ovary or pelvic growths using an endoscope,-,NC
Murphy Medical Center,Obstetrics,HCPCS 58661,Removal of ovaries and/or tubes using an endoscope,-,NC
Murphy Medical Center,Obstetrics,HCPCS 58545,Removal of uterine fibroid tumors using an endoscope,-,NC
Murphy Medical Center,Obstetrics,HCPCS 58262,"Vaginal removal of uterus, tubes, and/or ovaries",-,NC
Murphy Medical Center,Ocular,HCPCS 66984,Cataract removal,-,NC
Murphy Medical Center,Ocular,HCPCS 66982,Cataract removal with insertion of lens,-,NC
Murphy Medical Center,Ocular,HCPCS 66821,Laser cataract removal,-,NC
Murphy Medical Center,Ocular,HCPCS 67311,Realignment of the eye with repair of eye muscle,-,NC
Murphy Medical Center,Ocular,HCPCS 65426,Removal or relocation of corneal conjunctiva,-,NC
Murphy Medical Center,Ocular,HCPCS 67108,Repair of detached retina,-,NC
Murphy Medical Center,Ocular,HCPCS 65756,Transplant of outer layer of corneal tissue,-,NC
