Hospital Name,Category,ServiceCode,ServiceName,ServicePrice,State
Good Samaritan Hospital,Emergency Care,HCPCS 99292,"Emergency Critical Care, Each Additional 30 Minutes","$35,323.46",FL
Good Samaritan Hospital,Emergency Care,HCPCS 99291,"Emergency Critical Care, First 30 Minutes","$32,164.44",FL
Good Samaritan Hospital,Emergency Care,HCPCS 99283,Emergency Level 3,"$3,552.56",FL
Good Samaritan Hospital,Emergency Care,HCPCS 99284,Emergency Level 4,"$11,528.84",FL
Good Samaritan Hospital,Emergency Care,HCPCS 99285,Emergency Level 5,"$22,734.83",FL
Good Samaritan Hospital,Hospital,HCPCS 99218,Hospital Observation per Hour,"$27,850.22",FL
Good Samaritan Hospital,Office Visit,HCPCS 99204,"New patient office of other outpatient visit, typically 45 min",$610.19,FL
Good Samaritan Hospital,Speech,HCPCS 92507,Speech Therapy,"$2,817.25",FL
Good Samaritan Hospital,Speech,HCPCS 92610,Swallow Evaluation,"$14,439.22",FL
Good Samaritan Hospital,Speech,HCPCS 92526,Swallow Treatment,"$1,151.72",FL
Good Samaritan Hospital,Blood,HCPCS 85018,"Blood count, hemoglobin",$134.21,FL
Good Samaritan Hospital,Blood,HCPCS 85014,"Blood count, hemoglobin and hematocrit",$119.51,FL
Good Samaritan Hospital,Blood,HCPCS 85610,"Blood test, clotting time",$149.75,FL
Good Samaritan Hospital,Blood,HCPCS 85730,Coagulation assessment blood test,$556.79,FL
Good Samaritan Hospital,Blood,HCPCS 85025,"Complete blood cell count, with differential white blood cells, automated",$455.24,FL
Good Samaritan Hospital,Blood,HCPCS 85027,"Complete blood count, automated",$283.70,FL
Good Samaritan Hospital,Blood,HCPCS 85007,Microscopic examination for white blood cells with manual cell count,$214.66,FL
Good Samaritan Hospital,Blood,HCPCS P9016,"Red Blood Cells, Leukocytes Reduced, Each Unit","$8,019.77",FL
Good Samaritan Hospital,Chemistry,HCPCS 82150,Amylase (enzyme) level,$269.93,FL
Good Samaritan Hospital,Chemistry,HCPCS 84439,Assay of free thyroxine,$102.69,FL
Good Samaritan Hospital,Chemistry,HCPCS 82565,Blood creatinine level,$156.20,FL
Good Samaritan Hospital,Chemistry,HCPCS 84443,"Blood test, thyroid stimulating hormone (TSH)",$233.87,FL
Good Samaritan Hospital,Chemistry,HCPCS 82550,Creatine kinase Level (cardiac enzyme) - Total,$265.70,FL
Good Samaritan Hospital,Chemistry,HCPCS 82607,Cyanocobalamin (vitamin B-12) level,$224.18,FL
Good Samaritan Hospital,Chemistry,HCPCS 82728,Ferritin (blood protein) level,$329.97,FL
Good Samaritan Hospital,Chemistry,HCPCS 82746,Folic acid; serum,$231.89,FL
Good Samaritan Hospital,Chemistry,HCPCS 83036,Glycosylated hemoglobin test,$563.60,FL
Good Samaritan Hospital,Chemistry,HCPCS 83550,Iron Binding Capacity,$155.88,FL
Good Samaritan Hospital,Chemistry,HCPCS 83540,Iron level,$159.76,FL
Good Samaritan Hospital,Chemistry,HCPCS 83690,Lipase (fat enzyme) level,$337.94,FL
Good Samaritan Hospital,Chemistry,HCPCS 83735,Magnesium Level,$236.96,FL
Good Samaritan Hospital,Chemistry,HCPCS 82270,Stool analysis for blood,$76.11,FL
Good Samaritan Hospital,Chemistry,HCPCS 84156,"Total Protein Level, Urine",$124.88,FL
Good Samaritan Hospital,Chemistry,HCPCS 84550,"Uric acid level, blood",$206.09,FL
Good Samaritan Hospital,Chemistry,HCPCS 82306,Vitamin D; 25 hydroxy,$387.87,FL
Good Samaritan Hospital,Immunology,HCPCS 86140,Measurement C-reactive protein,$222.62,FL
Good Samaritan Hospital,Microbiology,HCPCS 87070,"Bacterial Culture, any source ",$446.51,FL
Good Samaritan Hospital,Microbiology,HCPCS 87086,Bacterial urine culture; quantitative colony count,$115.76,FL
Good Samaritan Hospital,Microbiology,HCPCS 87491,Chlamydia Test,$100.28,FL
Good Samaritan Hospital,Microbiology,HCPCS 87591,Detection Test for Neisseria Gonorrhoeae,$100.28,FL
Good Samaritan Hospital,Organ or Disease Oriented Panels,HCPCS 80048,Basic metabolic panel,$613.37,FL
Good Samaritan Hospital,Organ or Disease Oriented Panels,HCPCS 80053,"Blood test, comprehensive group of blood chemicals",$871.39,FL
Good Samaritan Hospital,Organ or Disease Oriented Panels,HCPCS 80061,"Blood test, lipids (cholesterol and triglycerides)",$381.78,FL
Good Samaritan Hospital,Organ or Disease Oriented Panels,HCPCS 80076,Liver function blood test panel,$626.18,FL
Good Samaritan Hospital,Surgical Pathology,HCPCS 88312,Special Stain for Microorganism; Gram or Glemsa Stain,$246.26,FL
Good Samaritan Hospital,Therapeutic Drug Assays,HCPCS 80307,Drug Test(s) by Chemistry Analyzer,"$3,206.42",FL
Good Samaritan Hospital,Transfusion,HCPCS 86900,"Blood Typing, ABO",$132.41,FL
Good Samaritan Hospital,Transfusion,HCPCS 86901,"Blood Typing, Rh (D)",$162.35,FL
Good Samaritan Hospital,Transfusion,HCPCS 86922,Blood Unit Compatibility Test; Antiglobulin Technique,$380.04,FL
Good Samaritan Hospital,Transfusion,HCPCS 86945,"Irradiation blood product, each unit",$223.60,FL
Good Samaritan Hospital,Urinalysis,HCPCS 81003,"Urinalysis, Automated Test",$86.57,FL
Good Samaritan Hospital,Urinalysis,HCPCS 81001,"Urinalysis with Examination, using Microscope",$297.11,FL
Good Samaritan Hospital,Urinalysis,HCPCS 81025,Urine Pregnancy Test,$691.07,FL
Good Samaritan Hospital,Cardiovascular,HCPCS 93017,"Cardiovascular stress test, without interpretation and report","$12,712.30",FL
Good Samaritan Hospital,Cardiovascular,HCPCS 93005,"Electrocardiogram, tracing only, without interpretation and report","$32,141.41",FL
Good Samaritan Hospital,Pulmonary,HCPCS 94640,Nebulizer Treatment,"$47,391.11",FL
Good Samaritan Hospital,Sleep,HCPCS 95810,Sleep study,"$7,693.08",FL
Good Samaritan Hospital,Breast,HCPCS 77063,3D Mammogram Screening (Tomosynthesis),$317.14,FL
Good Samaritan Hospital,Breast,HCPCS 77065,"Diagnostic mammography, unilateral",$505.25,FL
Good Samaritan Hospital,Breast,HCPCS 77067,Mammogram Screening,$787.39,FL
Good Samaritan Hospital,Breast,HCPCS 77066,Mammography of both breasts,$614.49,FL
Good Samaritan Hospital,CT Scan,HCPCS 71275,CT Angiogram Chest with and without Contrast,"$6,437.42",FL
Good Samaritan Hospital,CT Scan,HCPCS 70450,"CT scan, head or brain, without contrast","$3,524.17",FL
Good Samaritan Hospital,CT Scan,HCPCS 70486,"CT scan, maxillofacial area; without contrast material","$5,223.02",FL
Good Samaritan Hospital,CT Scan,HCPCS 74178,CT scan of abdomen & pelvis with and without contrast material,"$6,956.88",FL
Good Samaritan Hospital,CT Scan,HCPCS 74177,CT scan of abdomen & pelvis with contrast material,"$9,027.11",FL
Good Samaritan Hospital,CT Scan,HCPCS 74176,CT scan of abdomen & pelvis without contrast material,"$7,551.63",FL
Good Samaritan Hospital,CT Scan,HCPCS 71260,"CT Scan of thorax, with contrast material","$5,889.92",FL
Good Samaritan Hospital,CT Scan,HCPCS 71250,"CT Scan of thorax, without contrast material","$3,995.43",FL
Good Samaritan Hospital,CT Scan,HCPCS 72193,"CT scan, pelvis, with contrast","$7,205.25",FL
Good Samaritan Hospital,CT Scan,HCPCS 70491,"CT scan, soft tissue neck; with contrast material(s)","$6,477.20",FL
Good Samaritan Hospital,MRI,HCPCS 72148,MRI lumbar spine without contrast material,"$5,300.60",FL
Good Samaritan Hospital,MRI,HCPCS 72158,MRI lumbar spine without & with contrast material,"$6,745.28",FL
Good Samaritan Hospital,MRI,HCPCS 72141,MRI neck spine without contrast material,"$9,247.97",FL
Good Samaritan Hospital,MRI,HCPCS 74183,MRI of abdomen without & with contrast material,"$7,338.25",FL
Good Samaritan Hospital,MRI,HCPCS 73221,MRI of upper extremity joint; without contrast material,"$4,986.90",FL
Good Samaritan Hospital,MRI,HCPCS 70553,MRI scan of brain before and after contrast,"$6,630.98",FL
Good Samaritan Hospital,MRI,HCPCS 70551,MRI scan of brain (including brain stem); without contrast material,"$5,071.64",FL
Good Samaritan Hospital,MRI,HCPCS 73721,MRI scan of leg joint,"$5,226.80",FL
Good Samaritan Hospital,Ultrasound,HCPCS 76805,"Abdominal ultrasound of pregnant uterus, first trimester","$1,411.27",FL
Good Samaritan Hospital,Ultrasound,HCPCS 76770,"Ultrasound exam of abdomenal back wall, complete","$2,046.40",FL
Good Samaritan Hospital,Ultrasound,HCPCS 76536,Ultrasound exam of head and neck,"$2,028.90",FL
Good Samaritan Hospital,Ultrasound,HCPCS 76942,Ultrasound guidance for biopsy,"$1,364.67",FL
Good Samaritan Hospital,Ultrasound,HCPCS 76700,"Ultrasound of abdomen, complete","$2,764.05",FL
Good Samaritan Hospital,Ultrasound,HCPCS 76705,"Ultrasound of abdomen, limited","$1,793.95",FL
Good Samaritan Hospital,Ultrasound,HCPCS 76857,Ultrasound of pelvis,$578.52,FL
Good Samaritan Hospital,Ultrasound,HCPCS 76856,"Ultrasound, pelvic, complete","$1,743.89",FL
Good Samaritan Hospital,Ultrasound,HCPCS 76830,"Ultrasound, transvaginal","$1,553.56",FL
Good Samaritan Hospital,Chest,HCPCS 71046,X-ray of chest; 2 Views,$613.82,FL
Good Samaritan Hospital,Chest,HCPCS 71045,X-ray of chest; Single View,$525.57,FL
Good Samaritan Hospital,Chest,HCPCS 71100,"X-ray Ribs One Side, 2 Views",$581.63,FL
Good Samaritan Hospital,Hip and Pelvis,HCPCS 73502,"X-ray Hip and Pelvis, 2 Views","$1,101.79",FL
Good Samaritan Hospital,Hip and Pelvis,HCPCS 72170,"X-ray Pelvis, 2 Views","$1,052.87",FL
Good Samaritan Hospital,Lower Limbs,HCPCS 73610,"X-ray Ankle, 3 Views","$1,184.48",FL
Good Samaritan Hospital,Lower Limbs,HCPCS 73630,X-ray exam of foot,"$1,168.80",FL
Good Samaritan Hospital,Lower Limbs,HCPCS 73562,"X-ray exam of knee, 3 views","$1,610.24",FL
Good Samaritan Hospital,Lower Limbs,HCPCS 73620,"X-ray Foot, 2 Views",$833.43,FL
Good Samaritan Hospital,Lower Limbs,HCPCS 73650,"X-ray Heel, 2 Views",$892.52,FL
Good Samaritan Hospital,Lower Limbs,HCPCS 73560,"X-ray Knee, 1-2 Views",$819.85,FL
Good Samaritan Hospital,Lower Limbs,HCPCS 73590,"X-ray Lower Leg, 2 Views","$1,073.93",FL
Good Samaritan Hospital,Spine,HCPCS 72110,"X-ray, lower back, minimum four views","$1,483.73",FL
Good Samaritan Hospital,Spine,HCPCS 72040,"X-ray Lower Sacral Spine, 2-3 Views","$1,206.47",FL
Good Samaritan Hospital,Spine,HCPCS 72100,"X-ray Lower Sacral Spine, 2 or 3 views","$1,321.72",FL
Good Samaritan Hospital,Upper Limbs,HCPCS 73080,"X-ray Elbow, 3 Views","$1,165.79",FL
Good Samaritan Hospital,Upper Limbs,HCPCS 73140,"X-ray Fingers, 2 Views",$573.22,FL
Good Samaritan Hospital,Upper Limbs,HCPCS 73120,"X-ray Hand, 2 Views",$877.79,FL
Good Samaritan Hospital,Upper Limbs,HCPCS 73130,"X-ray Hand, 3 Views","$1,220.36",FL
Good Samaritan Hospital,Upper Limbs,HCPCS 73030,"X-ray Shoulder, 2 Views","$1,144.18",FL
Good Samaritan Hospital,Upper Limbs,HCPCS 73090,"X-ray Upper Arm, 2 Views",$743.10,FL
Good Samaritan Hospital,Upper Limbs,HCPCS 73100,"X-ray Wrist, 3 Views",$631.38,FL
Good Samaritan Hospital,Upper Limbs,HCPCS 73110,"X-ray Wrist, 3+ Views","$1,418.27",FL
Good Samaritan Hospital,Abdomenal,HCPCS 47562,Cholecystectomy,"$55,035.42",FL
Good Samaritan Hospital,Abdomenal,HCPCS 49505,Inguinal hernia repair (age over 5),"$50,280.39",FL
Good Samaritan Hospital,Abdomenal,HCPCS 51702,Insertion of Indwelling Bladder Catheter,"$29,482.74",FL
Good Samaritan Hospital,Abdomenal,HCPCS 44970,Removal of appendix using an endoscope (Outpatient),"$58,354.46",FL
Good Samaritan Hospital,Abdomenal,HCPCS 49650,Repair of groin hernia using an endoscope,"$49,049.81",FL
Good Samaritan Hospital,Breast,HCPCS 19120,Excision of cyst of breast,"$42,676.97",FL
Good Samaritan Hospital,Breast,HCPCS 19301,Partial removal of breast,"$54,859.10",FL
Good Samaritan Hospital,Digestive,HCPCS 45378,"Colonoscopy, diagnostic","$12,015.05",FL
Good Samaritan Hospital,Digestive,HCPCS 45380,"Colonoscopy, with biopsy","$12,556.63",FL
Good Samaritan Hospital,Digestive,HCPCS 45385,"Colonoscopy, with tumor removal (SNARE)","$13,590.06",FL
Good Samaritan Hospital,Digestive,HCPCS 43235,EGD,"$60,539.47",FL
Good Samaritan Hospital,Digestive,HCPCS 43239,EGD and biopsy,"$16,780.08",FL
Good Samaritan Hospital,Female Reproductive,MSDRG 743,"Uterine and adnexa procedures, non-malignancy","$80,910.53",FL
Good Samaritan Hospital,General,HCPCS 55700,Biopsy of prostate gland,"$24,862.51",FL
Good Samaritan Hospital,General,HCPCS 10060,Drainage of Abscess,"$27,157.76",FL
Good Samaritan Hospital,General,HCPCS 60240,Removal of thyroid,"$78,592.83",FL
Good Samaritan Hospital,General,HCPCS 12002,Repair of Wound (2.6 to 7.5 centimeters),"$1,890.05",FL
Good Samaritan Hospital,Musculoskeletal,HCPCS 62323,Injection of substance into spinal canal of lower back or sacrum using imaging guidance,"$7,304.86",FL
Good Samaritan Hospital,Musculoskeletal,HCPCS 64483,Injections of anesthetic and/or steroid drug into lower or sacral spine nerve root using imaging guidance,"$13,284.76",FL
Good Samaritan Hospital,Musculoskeletal,MSDRG 470,Joint replacement (hip or knee),"$118,632.43",FL
Good Samaritan Hospital,Musculoskeletal,HCPCS 29881,Knee arthroscopic cartilage removal,"$29,641.30",FL
Good Samaritan Hospital,Musculoskeletal,HCPCS 29826,Shoulder arthroscopy with bone shaving,"$69,792.92",FL
Good Samaritan Hospital,Musculoskeletal,MSDRG 473,Spinal fusion (cervical),"$279,514.12",FL
Good Samaritan Hospital,Musculoskeletal,MSDRG 460,Spinal fusion (non-cervical),"$303,839.39",FL
Good Samaritan Hospital,Obstetrics,HCPCS 58571,Abdominal removal of uterus with removal of tubes and/or ovaries using an endoscope,"$74,338.01",FL
Good Samaritan Hospital,Obstetrics,HCPCS 58558,Biopsy and/or removal of polyp of the uterus using an endoscope,"$28,781.84",FL
Good Samaritan Hospital,Obstetrics,MSDRG 788,Cesarean Section (C-Section) Delivery of Child,"$49,482.87",FL
Good Samaritan Hospital,Obstetrics,HCPCS 58661,Removal of ovaries and/or tubes using an endoscope,"$47,772.96",FL
Good Samaritan Hospital,Obstetrics,MSDRG 807,Vaginal Delivery of Child,"$28,313.36",FL
Good Samaritan Hospital,Vascular,HCPCS 36556,Insert non-tunneled catheter (age over 5),"$16,492.59",FL
Good Samaritan Hospital,Vascular,HCPCS 36430,Transfusion of Blood or Blood Products,"$7,362.06",FL
Good Samaritan Hospital,Vascular,HCPCS 36590,Ultrasound Veins of One Arm or Leg,"$12,589.10",FL
