Hospital Name,Category,ServiceCode,ServiceName,ServicePrice,State
Kennestone Hospital,Psychology,HCPCS 90847,"Family psychotherapy, including patient, 50 min",-,GA
Kennestone Hospital,Psychology,HCPCS 90846,"Family psychotherapy, not including patient, 50 min",-,GA
Kennestone Hospital,Psychology,HCPCS 90853,Group psychotherapy,-,GA
Kennestone Hospital,Psychology,HCPCS 90832,"Psychotherapy, 30 minutes with patient",-,GA
Kennestone Hospital,Psychology,HCPCS 90834,"Psychotherapy, 45 minutes with patient",-,GA
Kennestone Hospital,Psychology,HCPCS 90837,"Psychotherapy, 60 min",-,GA
Kennestone Hospital,Speech,HCPCS 92523,Evaluation of Speech Sound Production and Language Comprehenson,-,GA
Kennestone Hospital,Speech,HCPCS 92507,Speech Therapy,-,GA
Kennestone Hospital,Speech,HCPCS 92610,Swallow Evaluation,-,GA
Kennestone Hospital,Speech,HCPCS 92526,Swallow Treatment,-,GA
Kennestone Hospital,Blood,HCPCS 85610,"Blood test, clotting time",-,GA
Kennestone Hospital,Blood,HCPCS 85730,Coagulation assessment blood test,-,GA
Kennestone Hospital,Blood,HCPCS 85025,"Complete blood cell count, with differential white blood cells, automated",-,GA
Kennestone Hospital,Blood,HCPCS 85027,"Complete blood count, automated",-,GA
Kennestone Hospital,Chemistry,HCPCS 82105,"Alpha-Fetoprotein (AFP) Level, Serum",-,GA
Kennestone Hospital,Chemistry,HCPCS 84439,Assay of free thyroxine,-,GA
Kennestone Hospital,Chemistry,HCPCS 82232,Beta-2 microglobulin (protein) level,-,GA
Kennestone Hospital,Chemistry,HCPCS 84443,"Blood test, thyroid stimulating hormone (TSH)",-,GA
Kennestone Hospital,Chemistry,HCPCS 82310,Calcium level,-,GA
Kennestone Hospital,Chemistry,HCPCS 82607,Cyanocobalamin (vitamin B-12) level,-,GA
Kennestone Hospital,Chemistry,HCPCS 82652,"Dihydroxyvitamin D, 1, 25 level",-,GA
Kennestone Hospital,Chemistry,HCPCS 82728,Ferritin (blood protein) level,-,GA
Kennestone Hospital,Chemistry,HCPCS 82977,Glutamyltransferase (liver enzyme) level,-,GA
Kennestone Hospital,Chemistry,HCPCS 83036,Glycosylated hemoglobin test,-,GA
Kennestone Hospital,Chemistry,HCPCS 83550,Iron Binding Capacity,-,GA
Kennestone Hospital,Chemistry,HCPCS 83540,Iron level,-,GA
Kennestone Hospital,Chemistry,HCPCS 83735,Magnesium Level,-,GA
Kennestone Hospital,Chemistry,HCPCS 82436,Urine chloride level,-,GA
Kennestone Hospital,Chemistry,HCPCS 82043,Urine microalbumin (protein) level,-,GA
Kennestone Hospital,Chemistry,HCPCS 84133,Urine potassium level,-,GA
Kennestone Hospital,Chemistry,HCPCS 82306,Vitamin D; 25 hydroxy,-,GA
Kennestone Hospital,Immunology,HCPCS 86803,Confirmation test for Hepatitis C antibody,-,GA
Kennestone Hospital,Immunology,HCPCS 86140,Measurement C-reactive protein,-,GA
Kennestone Hospital,Immunology,HCPCS 86003,Measurement of antibody (IgE) to allergic substance,-,GA
Kennestone Hospital,Immunology,HCPCS 86308,Screening test for mononucleosis (mono),-,GA
Kennestone Hospital,Microbiology,HCPCS 87086,Bacterial urine culture; quantitative colony count,-,GA
Kennestone Hospital,Microbiology,HCPCS 87491,Chlamydia Test,-,GA
Kennestone Hospital,Microbiology,HCPCS 87324,Detection test for clostridium difficile toxins (stool pathogen),-,GA
Kennestone Hospital,Microbiology,HCPCS 87591,Detection Test for Neisseria Gonorrhoeae,-,GA
Kennestone Hospital,Microbiology,HCPCS 87389,HIV antigen and antibodies detection test,-,GA
Kennestone Hospital,Microbiology,HCPCS 86735,Mumps virus antibody test,-,GA
Kennestone Hospital,Microbiology,HCPCS 86765,Rubeola virus antibody test,-,GA
Kennestone Hospital,Microbiology,HCPCS 86780,Treponema pallidum antibody test,-,GA
Kennestone Hospital,Microbiology,HCPCS 86787,Varicella-zoster virus antibody test,-,GA
Kennestone Hospital,Organ or Disease Oriented Panels,HCPCS 80048,Basic metabolic panel,-,GA
Kennestone Hospital,Organ or Disease Oriented Panels,HCPCS 80053,"Blood test, comprehensive group of blood chemicals",-,GA
Kennestone Hospital,Organ or Disease Oriented Panels,HCPCS 80061,"Blood test, lipids (cholesterol and triglycerides)",-,GA
Kennestone Hospital,Organ or Disease Oriented Panels,HCPCS 80069,Kidney Function Blood Test Panel,-,GA
Kennestone Hospital,Organ or Disease Oriented Panels,HCPCS 80076,Liver function blood test panel,-,GA
Kennestone Hospital,Therapeutic Drug Assays,HCPCS 80178,Lithium Level,-,GA
Kennestone Hospital,Therapeutic Drug Assays,HCPCS 80185,Phenytoin level,-,GA
Kennestone Hospital,Urinalysis,HCPCS 81003,"Urinalysis, Automated Test",-,GA
Kennestone Hospital,Urinalysis,HCPCS 81002,"Urinalysis, Automated Test",-,GA
Kennestone Hospital,Urinalysis,HCPCS 81001,"Urinalysis with Examination, using Microscope",-,GA
Kennestone Hospital,Urinalysis,HCPCS 81025,Urine Pregnancy Test,-,GA
Kennestone Hospital,Cardiovascular,HCPCS 93015,"Cardiovascular stress test, with interpretation and report",-,GA
Kennestone Hospital,Cardiovascular,HCPCS 93005,"Electrocardiogram, tracing only, without interpretation and report",-,GA
Kennestone Hospital,Pulmonary,HCPCS 94640,Nebulizer Treatment,-,GA
Kennestone Hospital,Breast,HCPCS 77065,"Diagnostic mammography, unilateral",-,GA
Kennestone Hospital,Breast,HCPCS 77066,Mammography of both breasts,-,GA
Kennestone Hospital,CT Scan,HCPCS 71275,CT Angiogram Chest with and without Contrast,-,GA
Kennestone Hospital,CT Scan,HCPCS 74150,CT scan Abdomen without Contrast,-,GA
Kennestone Hospital,CT Scan,HCPCS 70450,"CT scan, head or brain, without contrast",-,GA
Kennestone Hospital,CT Scan,HCPCS 70486,"CT scan, maxillofacial area; without contrast material",-,GA
Kennestone Hospital,CT Scan,HCPCS 74178,CT scan of abdomen & pelvis with and without contrast material,-,GA
Kennestone Hospital,CT Scan,HCPCS 74177,CT scan of abdomen & pelvis with contrast material,-,GA
Kennestone Hospital,CT Scan,HCPCS 74176,CT scan of abdomen & pelvis without contrast material,-,GA
Kennestone Hospital,CT Scan,HCPCS 74160,CT scan of abdomen with contrast material,-,GA
Kennestone Hospital,CT Scan,HCPCS 74170,CT scan of abdomen without & with contrast material,-,GA
Kennestone Hospital,CT Scan,HCPCS 71260,"CT Scan of thorax, with contrast material",-,GA
Kennestone Hospital,CT Scan,HCPCS 71250,"CT Scan of thorax, without contrast material",-,GA
Kennestone Hospital,CT Scan,HCPCS 72193,"CT scan, pelvis, with contrast",-,GA
Kennestone Hospital,CT Scan,HCPCS 70491,"CT scan, soft tissue neck; with contrast material(s)",-,GA
Kennestone Hospital,MRA,HCPCS 70544,"Magnetic resonance angiography, head; without contrast material(s)",-,GA
Kennestone Hospital,MRI,HCPCS 72146,MRI chest spine without contrast material,-,GA
Kennestone Hospital,MRI,HCPCS 72148,MRI lumbar spine without contrast material,-,GA
Kennestone Hospital,MRI,HCPCS 72158,MRI lumbar spine without & with contrast material,-,GA
Kennestone Hospital,MRI,HCPCS 72141,MRI neck spine without contrast material,-,GA
Kennestone Hospital,MRI,HCPCS 72156,MRI neck spine without & with contrast material,-,GA
Kennestone Hospital,MRI,HCPCS 74183,MRI of abdomen without & with contrast material,-,GA
Kennestone Hospital,MRI,HCPCS 73221,MRI of upper extremity joint; without contrast material,-,GA
Kennestone Hospital,MRI,HCPCS 70553,MRI scan of brain before and after contrast,-,GA
Kennestone Hospital,MRI,HCPCS 70551,MRI scan of brain (including brain stem); without contrast material,-,GA
Kennestone Hospital,MRI,HCPCS 73721,MRI scan of leg joint,-,GA
Kennestone Hospital,Ultrasound,HCPCS 76805,"Abdominal ultrasound of pregnant uterus, first trimester",-,GA
Kennestone Hospital,Ultrasound,HCPCS 76506,Ultrasound Blood Flow Outside the Brain,-,GA
Kennestone Hospital,Ultrasound,HCPCS 76770,"Ultrasound exam of abdomenal back wall, complete",-,GA
Kennestone Hospital,Ultrasound,HCPCS 76536,Ultrasound exam of head and neck,-,GA
Kennestone Hospital,Ultrasound,HCPCS 76700,"Ultrasound of abdomen, complete",-,GA
Kennestone Hospital,Ultrasound,HCPCS 76705,"Ultrasound of abdomen, limited",-,GA
Kennestone Hospital,Ultrasound,HCPCS 76857,Ultrasound of pelvis,-,GA
Kennestone Hospital,Ultrasound,HCPCS 76856,"Ultrasound, pelvic, complete",-,GA
Kennestone Hospital,Ultrasound,HCPCS 76830,"Ultrasound, transvaginal",-,GA
Kennestone Hospital,Chest,HCPCS 71111,"X-ray of Both Sides of Ribs, Including Chest, Minimum of 4 Views",-,GA
Kennestone Hospital,Chest,HCPCS 71046,X-ray of chest; 2 Views,-,GA
Kennestone Hospital,Chest,HCPCS 71045,X-ray of chest; Single View,-,GA
Kennestone Hospital,Chest,HCPCS 71100,"X-ray Ribs One Side, 2 Views",-,GA
Kennestone Hospital,Head and Neck,HCPCS 70150,"X-ray of bones of face, minimum of 3 views",-,GA
Kennestone Hospital,Head and Neck,HCPCS 70160,"X-ray of bones of nose, minimum of 3 views",-,GA
Kennestone Hospital,Head and Neck,HCPCS 70360,X-ray of neck soft tissue,-,GA
Kennestone Hospital,Hip and Pelvis,HCPCS 73502,"X-ray Hip and Pelvis, 2 Views",-,GA
Kennestone Hospital,Hip and Pelvis,HCPCS 72170,"X-ray Pelvis, 1-2 Views",-,GA
Kennestone Hospital,Hip and Pelvis,HCPCS 72202,"X-ray Sacroiliac Joints, 3 or More Views",-,GA
Kennestone Hospital,Lower Limbs,HCPCS 73600,"X-ray Ankle, 2 Views",-,GA
Kennestone Hospital,Lower Limbs,HCPCS 73610,"X-ray Ankle, 3 Views",-,GA
Kennestone Hospital,Lower Limbs,HCPCS 73630,X-ray exam of foot,-,GA
Kennestone Hospital,Lower Limbs,HCPCS 73562,"X-ray exam of knee, 3 views",-,GA
Kennestone Hospital,Lower Limbs,HCPCS 73552,"X-ray Femur, 2 Views",-,GA
Kennestone Hospital,Lower Limbs,HCPCS 73620,"X-ray Foot, 2 Views",-,GA
Kennestone Hospital,Lower Limbs,HCPCS 73650,"X-ray Heel, 2 Views",-,GA
Kennestone Hospital,Lower Limbs,HCPCS 73560,"X-ray Knee, 1-2 Views",-,GA
Kennestone Hospital,Lower Limbs,HCPCS 73564,"X-ray Knee, 4 or More Views",-,GA
Kennestone Hospital,Lower Limbs,HCPCS 73590,"X-ray Lower Leg, 2 Views",-,GA
Kennestone Hospital,Spine,HCPCS 72110,"X-ray, lower back, minimum four views",-,GA
Kennestone Hospital,Spine,HCPCS 72100,"X-ray Lower Sacral Spine, 2 or 3 views",-,GA
Kennestone Hospital,Spine,HCPCS 72040,"X-ray Neck Spine, 2-3 Views",-,GA
Kennestone Hospital,Upper Limbs,HCPCS 73080,"X-ray Elbow, 3 Views",-,GA
Kennestone Hospital,Upper Limbs,HCPCS 73140,"X-ray Fingers, 2 Views",-,GA
Kennestone Hospital,Upper Limbs,HCPCS 73120,"X-ray Hand, 2 Views",-,GA
Kennestone Hospital,Upper Limbs,HCPCS 73130,"X-ray Hand, 3 Views",-,GA
Kennestone Hospital,Upper Limbs,HCPCS 73030,"X-ray Shoulder, 2 Views",-,GA
Kennestone Hospital,Upper Limbs,HCPCS 73090,"X-ray Upper Arm, 2 Views",-,GA
Kennestone Hospital,Upper Limbs,HCPCS 73100,"X-ray Wrist, 3 Views",-,GA
Kennestone Hospital,Upper Limbs,HCPCS 73110,"X-ray Wrist, 3+ Views",-,GA
Kennestone Hospital,Abdomenal,HCPCS 49505,Inguinal hernia repair (age over 5),-,GA
Kennestone Hospital,Breast,HCPCS 19120,Excision of cyst of breast,-,GA
Kennestone Hospital,Cardiac,HCPCS 93452,Diagnostic heart catheterization,-,GA
Kennestone Hospital,Digestive,HCPCS 45378,"Colonoscopy, diagnostic",-,GA
Kennestone Hospital,Digestive,HCPCS 45380,"Colonoscopy, with biopsy",-,GA
Kennestone Hospital,Digestive,HCPCS 45385,"Colonoscopy, with tumor removal (SNARE)",-,GA
Kennestone Hospital,Digestive,HCPCS 43235,EGD,-,GA
Kennestone Hospital,Digestive,HCPCS 43239,EGD and biopsy,-,GA
Kennestone Hospital,Digestive,HCPCS 45391,Ultrasound of lower large bowel using an endoscope,-,GA
Kennestone Hospital,General,HCPCS 55700,Biopsy of prostate gland,-,GA
Kennestone Hospital,General,HCPCS 10060,Drainage of Abscess,-,GA
Kennestone Hospital,Intraoral,HCPCS 42820,Tonsil removal (patient under 12),-,GA
Kennestone Hospital,Musculoskeletal,HCPCS 62323,Injection of substance into spinal canal of lower back or sacrum using imaging guidance,-,GA
Kennestone Hospital,Musculoskeletal,HCPCS 64483,Injections of anesthetic and/or steroid drug into lower or sacral spine nerve root using imaging guidance,-,GA
Kennestone Hospital,Musculoskeletal,HCPCS 20610,Joint arthrocentesis,-,GA
Kennestone Hospital,Musculoskeletal,HCPCS 29881,Knee arthroscopic cartilage removal,-,GA
Kennestone Hospital,Musculoskeletal,HCPCS 29826,Shoulder arthroscopy with bone shaving,-,GA
Kennestone Hospital,Obstetrics,HCPCS 59400,Routine obstetric care,-,GA
Kennestone Hospital,Obstetrics,HCPCS 59510,"Routine obstetric care for cesarean delivery, including pre-and postdelivery care",-,GA
Kennestone Hospital,Obstetrics,HCPCS 59610,Routine obstetric care for vaginal delivery after prior cesarean delivery including pre-and post-delivery care,-,GA
Kennestone Hospital,Ocular,HCPCS 66984,Cataract removal,-,GA
Kennestone Hospital,Ocular,HCPCS 66821,Laser cataract removal,-,GA
